/home/rob/Reference/Crawls/www.snopes.com/inboxer/hoaxes/march8.asp	False	Web site will reveal an "astounding" discovery to the world on 
/home/rob/Reference/Crawls/www.snopes.com/inboxer/hoaxes/tracking.asp	False	All messages sent to U.S. government employees on 
/home/rob/Reference/Crawls/www.snopes.com/inboxer/hoaxes/mileycyrus.asp	False	
/home/rob/Reference/Crawls/www.snopes.com/inboxer/hoaxes/matthews.asp	False	Popular entertainer Dave Matthews is dead.
/home/rob/Reference/Crawls/www.snopes.com/inboxer/hoaxes/johnnydepp.asp	False	Actor Johnny Depp died of a heart attack in March 2007.
/home/rob/Reference/Crawls/www.snopes.com/inboxer/hoaxes/download.asp	False	The FBI's "Department for Illegal Internet Downloads" is sending out automated warning messages via e-mail. 
/home/rob/Reference/Crawls/www.snopes.com/inboxer/hoaxes/overload.asp	False	Your free online service (list and links below) is about to cancel the accounts of users who don't forward or repost a particular message.
/home/rob/Reference/Crawls/www.snopes.com/inboxer/hoaxes/homeless.asp	False	The U.S. government planning to track homeless persons by implanting them with RFID chips.
/home/rob/Reference/Crawls/www.snopes.com/inboxer/hoaxes/marryourdaughter.asp	False	Customers can "purchase" teenage brides through the web site MarryOurDaughter.com.
/home/rob/Reference/Crawls/www.snopes.com/inboxer/hoaxes/50cent.asp	False	Rapper 50 Cent underwent emergency surgery to reattach a hand severed by a car door.
/home/rob/Reference/Crawls/www.snopes.com/inboxer/hoaxes/walken.asp	False	Actor Christopher Walken is planning on making a bid for the U.S. presidency in 2008.
/home/rob/Reference/Crawls/www.snopes.com/inboxer/hoaxes/flashim.asp	False	A flashing Instant Message is a sign that someone is trying to steal your password.
/home/rob/Reference/Crawls/www.snopes.com/inboxer/hoaxes/dalai.asp	False	An "Instructions for Life" chain mail mantra was written by the Dalai Lama. 
/home/rob/Reference/Crawls/www.snopes.com/inboxer/hoaxes/videoclip.asp	False	Forwarding a certain e-mail to a specified number of your friends will cause a cool video to spring to life on your monitor or win cash for you. 
/home/rob/Reference/Crawls/www.snopes.com/inboxer/hoaxes/helpmybabylive.asp	False	You should donate money to help an expectant couple seeking to raise $50,000 in order to avoid opting for an abortion.
/home/rob/Reference/Crawls/www.snopes.com/inboxer/hoaxes/tedbundy.asp	False	The governor of Florida asked residents to reduce their electrical usage during Ted Bundy's execution.
/home/rob/Reference/Crawls/www.snopes.com/inboxer/hoaxes/breastfeeding.asp	False	An organization called  'Citizens Against Breast-Feeding' is petitioning Congress to outlaw breast-feeding.
/home/rob/Reference/Crawls/www.snopes.com/inboxer/hoaxes/lasikathome.asp	False	Web site offers a device for performing LASIK eye surgery at home.
/home/rob/Reference/Crawls/www.snopes.com/inboxer/hoaxes/tomhanks.asp	False	Actor Tom Hanks or Tom Cruise fell to his death while making a film in New Zealand.
/home/rob/Reference/Crawls/www.snopes.com/inboxer/hoaxes/felonspy.asp	False	Web site provides listings of violent criminals residing in your neighborhood.
/home/rob/Reference/Crawls/www.snopes.com/inboxer/hoaxes/bensavage.asp	False	Actor Ben Savage was killed in a 
/home/rob/Reference/Crawls/www.snopes.com/inboxer/hoaxes/shuttle.asp	False	A Nostradamus prophecy foretold the Space Shuttle Columbia disaster.
/home/rob/Reference/Crawls/www.snopes.com/inboxer/hoaxes/deadfairy.asp	False	Photograph shows the remains of an 8-inch, mummified fairy found in Derbyshire.
/home/rob/Reference/Crawls/www.snopes.com/inboxer/hoaxes/gerber.asp	False	Parents are entitled to claim one $500 savings bond per child from Gerber because Gerber lied about using nothing but natural ingredients in its baby food.
/home/rob/Reference/Crawls/www.snopes.com/inboxer/hoaxes/babyink.asp	False	The Baby Ink body art chain specializes in tattooing babies and children.
/home/rob/Reference/Crawls/www.snopes.com/inboxer/hoaxes/parishilton.asp	False	Paris Hilton has been stabbed several times in the jail where she is serving out her sentence.
/home/rob/Reference/Crawls/www.snopes.com/inboxer/hoaxes/genesimmons.asp	False	KISS frontman Gene Simmons was found dead in his house in November 2007.
/home/rob/Reference/Crawls/www.snopes.com/inboxer/hoaxes/tupac.asp	False	CNN has reported that rapper Tupac Shakur is alive.
/home/rob/Reference/Crawls/www.snopes.com/inboxer/hoaxes/medicaladoptions.asp	False	Web site offers to sell third-world orphans for adoption as organ donors.
/home/rob/Reference/Crawls/www.snopes.com/inboxer/hoaxes/sinbad.asp	False	Comedian/actor Sinbad died of a heart attack in March 2007.
/home/rob/Reference/Crawls/www.snopes.com/inboxer/hoaxes/puppyprofits.asp	False	Web site offers a program for participating and investing in the business of "Canine Sport Fighting." 
/home/rob/Reference/Crawls/www.snopes.com/inboxer/hoaxes/computer.asp	False	Photograph shows RAND Corporation's 1954 design for a home computer.
/home/rob/Reference/Crawls/www.snopes.com/inboxer/hoaxes/babyformula.asp	False	Parents of children born between 1980 and 1991 are entitled to a $1400 settlement from Enfamil and Similac.
/home/rob/Reference/Crawls/www.snopes.com/inboxer/hoaxes/britneydead.asp	False	Singer Britney Spears committed suicide at the Promises clinic in October 2007.
/home/rob/Reference/Crawls/www.snopes.com/inboxer/hoaxes/manbeef.asp	False	You can purchase human meat through a company called ManBeef.
/home/rob/Reference/Crawls/www.snopes.com/inboxer/hoaxes/ferrell.asp	False	Actor Will Ferrell was killed in a paragliding accident.
/home/rob/Reference/Crawls/www.snopes.com/inboxer/hoaxes/nakedchef.asp	False	A forthcoming Jamie Oliver cookery book, 
/home/rob/Reference/Crawls/www.snopes.com/inboxer/hoaxes/sister.asp	False	A one-item psych test will reveal the psychopaths in your life. 
/home/rob/Reference/Crawls/www.snopes.com/inboxer/hoaxes/presiq.asp	False	According to a study by the Lovenstein Institute, President Bush has the lowest IQ of all presidents of past 
/home/rob/Reference/Crawls/www.snopes.com/inboxer/hoaxes/orphans.asp	Undetermined	Children orphaned by the Indian Ocean tsunami are being offered for sale via SMS messages.
/home/rob/Reference/Crawls/www.snopes.com/inboxer/hoaxes/yahoo.asp	Undetermined	Someone claiming to be the "Yahoo Community Monitor" is joining discussion groups and mischievously deleting them.
/home/rob/Reference/Crawls/www.snopes.com/inboxer/hoaxes/veterans.asp	False	Congress has approved special insurance dividend payments for veterans.
/home/rob/Reference/Crawls/www.snopes.com/inboxer/hoaxes/murdered.asp	False	Employee of a law firm sends nonchalant message about replacement of a murdered secretary.
/home/rob/Reference/Crawls/www.snopes.com/inboxer/hoaxes/kaufman.asp	False	Comedian Andy Kaufman has returned, twenty years after faking his death.
/home/rob/Reference/Crawls/www.snopes.com/inboxer/hoaxes/ibuystrays.asp	False	Web site offers to buy unwanted cats and dogs to 
/home/rob/Reference/Crawls/www.snopes.com/inboxer/hoaxes/metallica.asp	False	Heavy metal band Metallica is suing the group Unfaith over their use of the E and F chords.
/home/rob/Reference/Crawls/www.snopes.com/inboxer/hoaxes/stalker.asp	False	Through the web site coincidencedesign.com, you can arrange to "accidentally" meet the girl of your dreams by having her habits researched so you'll know where and when to run into her and then what to say. 
/home/rob/Reference/Crawls/www.snopes.com/inboxer/hoaxes/moon.asp	False	A video clip show a NASA studio-produced 'outtake' of the first moon landing.
/home/rob/Reference/Crawls/www.snopes.com/inboxer/hoaxes/axlrose.asp	False	Singer Axl Rose died of a drug overdose in Las Vegas in October 2006.
/home/rob/Reference/Crawls/www.snopes.com/inboxer/hoaxes/survivor.asp	False	A reality show on NBC will feature women being pursued through the brush by rapists.
/home/rob/Reference/Crawls/www.snopes.com/inboxer/hoaxes/deervest.asp	False	In an effort to protect the deer population, PETA has taken to dressing deer in orange hunters' vests. Consequently, local hunters are having a very easy time drawing a bead on these animals and downing them. A sporting goods store offers rewards for the returned vests and a 
/home/rob/Reference/Crawls/www.snopes.com/inboxer/hoaxes/duanemartin.asp	False	E-mail reproduces TMZ article about Duane Martin and Tisha Campbell
/home/rob/Reference/Crawls/www.snopes.com/inboxer/hoaxes/tissue.asp	False	The fall 2003 California wildfires left the U.S. facing a severe toilet paper shortage.
/home/rob/Reference/Crawls/www.snopes.com/inboxer/hoaxes/travisbarker.asp	False	Drummer Travis Barker was found dead in his garage in November 2007.
/home/rob/Reference/Crawls/www.snopes.com/inboxer/trivia/dalai.asp	False	The Dalai Lama created a personality test.
/home/rob/Reference/Crawls/www.snopes.com/inboxer/trivia/1981.asp	Multiple &mdash; see below	E-mail lists interesting coincidences between the years 1981 and 2005.
/home/rob/Reference/Crawls/www.snopes.com/inboxer/trivia/billions.asp	Multiple &mdash; see below	List demonstrates the concept of "a billion."
/home/rob/Reference/Crawls/www.snopes.com/inboxer/trivia/qe2.asp	False	The ocean liner QE2 uses a gallon of fuel for every six inches she travels.
/home/rob/Reference/Crawls/www.snopes.com/inboxer/school/gemma.asp	False	Gemma Brown is collecting spam and chain e-mails for a university study.
/home/rob/Reference/Crawls/www.snopes.com/inboxer/school/syfrett.asp	Not any more	A 9th grader named Shannon Syfrett is collecting 
/home/rob/Reference/Crawls/www.snopes.com/inboxer/school/lawton.asp	Not any more	A 2nd grader named Kellie Lawton is collecting 
/home/rob/Reference/Crawls/www.snopes.com/inboxer/school/names.asp	False	A teacher wants you to add your name to a growing list of first names for a school science project.
/home/rob/Reference/Crawls/www.snopes.com/inboxer/petition/abortion.asp	False	A girl is going to have an abortion unless 500 
/home/rob/Reference/Crawls/www.snopes.com/inboxer/petition/brazil.asp	False	The Brazilian Congress is about to vote on a bill that would reduce the size of the Amazon rain forest by 50%.
/home/rob/Reference/Crawls/www.snopes.com/inboxer/petition/braball.asp	True	A California artist is collecting brassieres  to use in constructing a giant Bra Ball.
/home/rob/Reference/Crawls/www.snopes.com/inboxer/petition/dameedna.asp	True	Dame Edna advised a reader against learning Spanish in her satirical 
/home/rob/Reference/Crawls/www.snopes.com/inboxer/petition/internet.asp	False	Signing and circulating online petitions is an effective way of remedying important issues. 
/home/rob/Reference/Crawls/www.snopes.com/inboxer/petition/walkout.asp	False	Twenty-five Congresswomen staged a walkout during a vote on a resolution to authorize the use of military force against Iraq.
/home/rob/Reference/Crawls/www.snopes.com/inboxer/petition/nick.asp	Sort of	Nickelodeon will air a TV show that portrays homosexuality in a positive light.
/home/rob/Reference/Crawls/www.snopes.com/inboxer/petition/rice.asp	False	Bags of rice sent to President Eisenhower helped dissuade him from launching an attack against China.
/home/rob/Reference/Crawls/www.snopes.com/inboxer/petition/boyscout.asp	True	The Boy Scouts of America has lost some funding over its refusal to accept homosexuals within its ranks.
/home/rob/Reference/Crawls/www.snopes.com/inboxer/petition/cc.asp	False	Closed captioning of television programs will end on 30 September 2001.  After that date, only those who pay extra for the service will be able to use it.
/home/rob/Reference/Crawls/www.snopes.com/inboxer/petition/joesrant.asp	False	Ontario's Consumer Minister is looking to get the popular Molson beer commercial, Joe's Rant, banned from the airwaves because it upsets Americans.
/home/rob/Reference/Crawls/www.snopes.com/inboxer/petition/im.asp	False	AOL, MSN, Yahoo!, or MSN is about to start charging for its instant messaging service unless an Internet petition opposing the fee increase attracts a specified number of signatures by a named date.
/home/rob/Reference/Crawls/www.snopes.com/inboxer/petition/lieberman.asp	False	Senator Joseph Lieberman authored an 'Open Letter to the French People,' expressing his contempt for French tolerance of anti-Semitism.
/home/rob/Reference/Crawls/www.snopes.com/inboxer/petition/arctic.asp	Not any more	Calling the White House will help influence President Clinton to protect the Arctic National Wildlife Refuge from commercial development by designating it a national monument.
/home/rob/Reference/Crawls/www.snopes.com/inboxer/petition/false.asp	False	Internet petitions contain embedded "tracker programs" that plant cookies on signers' computers and send their 
/home/rob/Reference/Crawls/www.snopes.com/inboxer/petition/palestin.asp	Not quite	McDonald's is donating a portion of their sales to injured Palestinians.
/home/rob/Reference/Crawls/www.snopes.com/inboxer/petition/afghani.asp	True	Women in Afghanistan are subject to severe violations of basic human rights (but signing a petition isn't likely to help them).
/home/rob/Reference/Crawls/www.snopes.com/inboxer/petition/drunk.asp	False	Signing a petition will help stop drunk driving.
/home/rob/Reference/Crawls/www.snopes.com/inboxer/petition/cane.asp	True	A 17-year-old Nigerian girl was publicly flogged for having engaged in premarital sex.
/home/rob/Reference/Crawls/www.snopes.com/inboxer/petition/babyrape.asp	Undetermined	The belief that having sex with virgins will cure AIDS has led to a marked increase in the rapes of infants and children in South Africa.
/home/rob/Reference/Crawls/www.snopes.com/inboxer/petition/rape.asp	True	Due to a savage attack on a 12-year old cousin, a South African woman is gathering signatures to attempt to persuade her government to punish rapists more severely.
/home/rob/Reference/Crawls/www.snopes.com/inboxer/petition/nobel.asp	False	The collection of a million signatures on a petition will spur the Nobel Foundation into revoking the portion of the 1994 Nobel Peace Prize awarded to Palestinian leader Yasser Arafat.
/home/rob/Reference/Crawls/www.snopes.com/inboxer/petition/marriage.asp	Sort of	A constitutional amendment that would "ban homosexual marriages and civil unions" is "being pushed through Congress."
/home/rob/Reference/Crawls/www.snopes.com/inboxer/petition/abcjesus.asp	True	ABC bleeped the word 'Jesus' from a segment of 
/home/rob/Reference/Crawls/www.snopes.com/inboxer/petition/danita.asp	Multiple &mdash; see below	Petition seeks to persuade the television show 
/home/rob/Reference/Crawls/www.snopes.com/inboxer/petition/pledge.asp	True	An appeals court ruled that teacher-led recitation of the Pledge of Allegiance in public schools is unconstitutional.
/home/rob/Reference/Crawls/www.snopes.com/inboxer/petition/safiya.asp	Was true, but isn't any more	Safiya Hussaini, a Nigerian woman, has been sentenced to death by stoning for committing adultery.
/home/rob/Reference/Crawls/www.snopes.com/inboxer/petition/prayer.asp	Not likely	Signing an e-petition to President Bush will help get organized prayer reinstated in public schools.
/home/rob/Reference/Crawls/www.snopes.com/inboxer/petition/belief.asp	False	Someone is in a race to collect the e-signatures of 300 people who believe in God before someone else collects 
/home/rob/Reference/Crawls/www.snopes.com/inboxer/petition/bernard.asp	True	St. Bernard dogs are being raised for food in China.
/home/rob/Reference/Crawls/www.snopes.com/inboxer/petition/yahoo.asp	True	Yahoo! will begin charging for its previously-free POP 
/home/rob/Reference/Crawls/www.snopes.com/inboxer/petition/herbal.asp	False	A rider appended to a Congressional bill will require that consumers obtain prescriptions before purchasing herbal remedies.
/home/rob/Reference/Crawls/www.snopes.com/inboxer/petition/taylor.asp	Not any longer	Students at an elementary school are collecting e-mail messages for a school project.
/home/rob/Reference/Crawls/www.snopes.com/inboxer/petition/iraqcall.asp	Sort of	The White House is soliciting phone calls to record public opinion about a proposed war with Iraq.
/home/rob/Reference/Crawls/www.snopes.com/inboxer/petition/amina.asp	Was true, but her conviction has been overturned	Amina Lawal, a Nigerian woman, has been sentenced to death by stoning for committing adultery.
/home/rob/Reference/Crawls/www.snopes.com/inboxer/children/nick.asp	Multiple:	Nick Waters, a 15-year-old physically-challenged boy living in Georgia, wants 10,000 Christmas cards.
/home/rob/Reference/Crawls/www.snopes.com/inboxer/children/relek.asp	False	BCC Inc. will donate 5? per 
/home/rob/Reference/Crawls/www.snopes.com/inboxer/children/savannah.asp	False	Three businesses stand poised to help Savannah Foraker, a child dying of a blood disease, to the tune of 5&cent per 
/home/rob/Reference/Crawls/www.snopes.com/inboxer/children/ryan.asp	Not any more	Is a 14-year-old Michigan girl named Lindsey Ryan missing?
/home/rob/Reference/Crawls/www.snopes.com/inboxer/children/pingel.asp	True	Prayers are requsted for Lauren Renee Pingel, a three-year-old girl from Amarillo, Texas, who was injured in an automobile accident.
/home/rob/Reference/Crawls/www.snopes.com/inboxer/children/thomson.asp	True	A 7th-grader named Dean Thomson was badly injured in a sledding accident.
/home/rob/Reference/Crawls/www.snopes.com/inboxer/children/zhang.asp	Not any more	Nine-year-old Cecilia Zhang is missing from her Toronto home.
/home/rob/Reference/Crawls/www.snopes.com/inboxer/children/parkin.asp	False	A little boy dying of leukemia sent a message out on the Internet asking people to keep forwarding it so that some small part of him would live forever.
/home/rob/Reference/Crawls/www.snopes.com/inboxer/children/veski.asp	Undetermined	Laima Veski, a 5-year-old girl, needs your donations to survive.
/home/rob/Reference/Crawls/www.snopes.com/inboxer/children/steinmet.asp	Not any more	A toddler named Aaron Russell Steimetz is missing, and you should forward the plea to help find him to everyone you know.
/home/rob/Reference/Crawls/www.snopes.com/inboxer/children/walmart.asp	False	AOL is reducing by $2 per 
/home/rob/Reference/Crawls/www.snopes.com/inboxer/children/smart.asp	Not any more	A 14-year-old Salt Lake City girl by the name of Elizabeth Smart is missing.
/home/rob/Reference/Crawls/www.snopes.com/inboxer/children/santillan.asp	Not any more	Jesica Santillan, a 17-year-old girl who received the wrong heart and lungs in a transplant, needs prayers to survive.
/home/rob/Reference/Crawls/www.snopes.com/inboxer/children/sabrina.asp	True	A five-year-old girl named Sabrina Fair Allen is missing from her Austin, Texas, home.
/home/rob/Reference/Crawls/www.snopes.com/inboxer/pending/internet.asp	True	A moratorium on Internet taxation expires in 2007.
/home/rob/Reference/Crawls/www.snopes.com/inboxer/pending/mexican.asp	False	A bill currently before Congress (HR 219) would prevent Mexicans who worked in the USA illegally from claiming Social Security benefits.
/home/rob/Reference/Crawls/www.snopes.com/inboxer/pending/geocity.asp	False	GeoCities web sites are about to be shut down with no advance notice.
/home/rob/Reference/Crawls/www.snopes.com/inboxer/pending/callscam.asp	True	Telemarketers are luring those who've signed up for the national "Do Not Call" list by getting them to request coupons for free products.
/home/rob/Reference/Crawls/www.snopes.com/inboxer/pending/sbc.asp	Sort of	SBC Ameritech customers must contact the company within thirty days to prevent the distribution of their personal information.
/home/rob/Reference/Crawls/www.snopes.com/inboxer/pending/inaction.asp	False	Congress will be voting on a bill that would  prohibit the use of affirmative action measures in admissions procedures at any colleges and universities that receive federal funding.
/home/rob/Reference/Crawls/www.snopes.com/inboxer/pending/texascell.asp	False	A bill passed by the Texas legislature will outlaw using a cell phone while operating a motor vehicle as of 
/home/rob/Reference/Crawls/www.snopes.com/inboxer/pending/fcc.asp	True	The FCC plans to loosen its strictures against conglomerate ownership of media outlets.
/home/rob/Reference/Crawls/www.snopes.com/inboxer/pending/credit.asp	False	The four major U.S. credit bureaus will be allowed to share your private information with anyone who requests it as of 
/home/rob/Reference/Crawls/www.snopes.com/inboxer/pending/blackcol.asp	False	Fourteen black colleges are about to be closed.
/home/rob/Reference/Crawls/www.snopes.com/inboxer/pending/donotcall.asp	True	The federal government has established a national "Do Not Call" registry to stop calls from telemarketers.
/home/rob/Reference/Crawls/www.snopes.com/inboxer/pending/handgun.asp	Sort of	A pending Senate bill would require that all gun owners list their guns on federal income tax returns.
/home/rob/Reference/Crawls/www.snopes.com/inboxer/pending/voting.asp	False	Legislation guaranteeing blacks the right to vote in the USA will expire in 2007. 
/home/rob/Reference/Crawls/www.snopes.com/inboxer/scams/postcode.asp	False	Office workers in the United Kingdom are being conned into revealing their home addresses, leading to their houses being burgled during the day.
/home/rob/Reference/Crawls/www.snopes.com/inboxer/scams/irsform.asp	True	Con artists are circulating letters demanding the completion of fake IRS forms that would arm them with all the information necessary to steal the identities and empty the bank accounts of those who fall for this ruse. 
/home/rob/Reference/Crawls/www.snopes.com/inboxer/scams/mobile.asp	Multiple &mdash; see below:	In Britain, mobile phone owners are being tricked into calling numbers that charge them ?50 a minute.
/home/rob/Reference/Crawls/www.snopes.com/inboxer/scams/license.asp	False	You can avoid paying for traffic tickets or establish a new identity by obtaining an International Driver's License.
/home/rob/Reference/Crawls/www.snopes.com/inboxer/scams/refunds.asp	False	You can make up to $75 per hour processing refunds for FedEx and UPS.
/home/rob/Reference/Crawls/www.snopes.com/inboxer/scams/flowers.asp	True	Scam traps the unwary into giving up their AOL information by telling them roses have been ordered through 1-800-Flowers.
/home/rob/Reference/Crawls/www.snopes.com/inboxer/scams/citibank3.asp	False	Citibank is sending out notices asking customers to log in and verify their accounts.
/home/rob/Reference/Crawls/www.snopes.com/inboxer/scams/cartel.asp	False	You can make money by learning the secrets of an organization known as the 'World Currency Cartel.'
/home/rob/Reference/Crawls/www.snopes.com/inboxer/scams/gascharge.asp	False	Gas stations are routinely imposing an extra $10 fee on credit card customers.
/home/rob/Reference/Crawls/www.snopes.com/inboxer/scams/tickets.asp	Undetermined	Several on-line airline ticket sites are scams used to harvest credit card numbers or cheat consumers out of their money.
/home/rob/Reference/Crawls/www.snopes.com/inboxer/scams/earthlink.asp	False	Earthlink is sending out suspension notices via e-mail and asking subscribers to verify their credit card information.
/home/rob/Reference/Crawls/www.snopes.com/inboxer/scams/valentin.asp	False	A student in Russia named Valentin Mikhaylin needs your financial assistance to heat his apartment, buy food, and provide medical care for his ailing mother.
/home/rob/Reference/Crawls/www.snopes.com/inboxer/scams/moneynow.asp	False	A company called Send Money Now has charged $373.56 to your debit card.
/home/rob/Reference/Crawls/www.snopes.com/inboxer/scams/citibank2.asp	False	Citibank is sending out messages asking customers to verify their e-mail addresses.
/home/rob/Reference/Crawls/www.snopes.com/inboxer/scams/irsaudit.asp	Sort of	The Michigan Department of Treasury issued an alert about fraudulent 
/home/rob/Reference/Crawls/www.snopes.com/inboxer/scams/sergei.asp	Undetermined	A Russian boy named Sergei needs adoptive parents.
/home/rob/Reference/Crawls/www.snopes.com/inboxer/scams/paypal.asp	False	As part of regular security maintenance, Paypal needs you to resubmit your credit card and bank account information.
/home/rob/Reference/Crawls/www.snopes.com/inboxer/scams/jiffylube.asp	True	TV news investigation shows Jiffy Lube outlets charging customers for automotive maintenance work that was never done.
/home/rob/Reference/Crawls/www.snopes.com/inboxer/scams/visascam.asp	Undetermined	Phony 
/home/rob/Reference/Crawls/www.snopes.com/inboxer/scams/laundry.asp	False	Your credit card has been charged $234.65 for "laundry service."
/home/rob/Reference/Crawls/www.snopes.com/inboxer/scams/birthday.asp	Sort of	Personal information that might be used in identity theft schemes against you can be obtained from the web site anybirthday.com.
/home/rob/Reference/Crawls/www.snopes.com/inboxer/scams/census.asp	Undetermined	People posing as census workers are attempting to elicit personal information over the telephone.
/home/rob/Reference/Crawls/www.snopes.com/inboxer/scams/cashback.asp	Undetermined	Retail cashiers commonly steal from customers by tricking them into requesting cash back and then pocketing their money.
/home/rob/Reference/Crawls/www.snopes.com/inboxer/scams/credit.asp	True	E-mail from lawyer gives good advice about preventive steps to protect against credit card theft.
/home/rob/Reference/Crawls/www.snopes.com/inboxer/scams/forward.asp	True	Scammers con victims into forwarding their phones to other numbers.
/home/rob/Reference/Crawls/www.snopes.com/inboxer/scams/inherit.asp	False	Because you share your surname with a wealthy dead guy, you're in line for a windfall inheritance.
/home/rob/Reference/Crawls/www.snopes.com/inboxer/scams/chain.asp	False	A 15-year-old boy made $71,000 from a chain letter scheme.
