/home/rob/Reference/Crawls/www.snopes.com/college/homework/foundcar.asp	True	Diligent student finds hidden reward tucked away in academic work.
/home/rob/Reference/Crawls/www.snopes.com/college/homework/unsolvable.asp?print=y	True	Student mistakes examples of unsolvable math problems for homework assignment and solves them.
/home/rob/Reference/Crawls/www.snopes.com/college/admin/wait.asp	False	All colleges have regulations specifying how long students must wait if an instructor fails to appear, and these wait times vary depending upon the academic rank of the instructor.
/home/rob/Reference/Crawls/www.snopes.com/college/admin/swimtest.asp	False	University implements mandatory swim tests at the behest of a wealthy benefactor whose own child had drowned.
/home/rob/Reference/Crawls/www.snopes.com/college/admin/icecream.asp	False	A university serves ice cream at every meal because a benefactor who donated a large sum of money stipulated that a portion of the funds be used for that purpose.
/home/rob/Reference/Crawls/www.snopes.com/college/admin/cent.asp	True	An enterprising college student solicited one-cent donations to finance his education.
/home/rob/Reference/Crawls/www.snopes.com/college/admin/jobpost.asp	True	College fills open faculty position through cynical job posting.
/home/rob/Reference/Crawls/www.snopes.com/college/admin/suicide.asp	False	A standard college regulation specifies that a student whose roommate commits suicide automatically receive a 
/home/rob/Reference/Crawls/www.snopes.com/college/admin/kissinger.asp	False	Henry Kissinger was the last student to graduate from Harvard with perfect grades.
/home/rob/Reference/Crawls/www.snopes.com/college/admin/playboy.asp	Multiple &mdash; see below	
/home/rob/Reference/Crawls/www.snopes.com/college/admin/eisenhower.asp	False	Dwight D. Eisenhower became president of Columbia University because the school's trustees confused him with his brother, Milton.
/home/rob/Reference/Crawls/www.snopes.com/weddings/embarrass/manure.asp	True	A scorned woman dumped a bucket of manure onto the bride who ended up with her boyfriend.
/home/rob/Reference/Crawls/www.snopes.com/weddings/embarrass/hangup.asp	True	Drunken bride's attempt to hang up her wedding dress results in hotel evacuation.
/home/rob/Reference/Crawls/www.snopes.com/weddings/embarrass/cakefight.asp	True	Cute cake custom causes contretemps.
/home/rob/Reference/Crawls/www.snopes.com/weddings/embarrass/cakepelt.asp	True	Bride is jailed after pelting her husband with wedding cake.
/home/rob/Reference/Crawls/www.snopes.com/weddings/embarrass/bridezilla.asp	Undetermined	Bride-to-be sends over-the-top list of instructions to her attendants.
/home/rob/Reference/Crawls/www.snopes.com/weddings/newlywed/beckham.asp	False	David and Victoria (aka "Posh Spice") Beckham paid off another couple's mortgage to get them to give up their claim to a reception hall or hotel suite the famous couple coveted for their own wedding.
/home/rob/Reference/Crawls/www.snopes.com/weddings/newlywed/advice.asp	Undetermined	An 1894 treatise against the evils of marital sex exhorted young brides to "give little, give seldom, and above all, give grudgingly."
/home/rob/Reference/Crawls/www.snopes.com/weddings/horrors/titanium.asp	False	Titanium rings can be removed from swollen fingers only through amputation.
/home/rob/Reference/Crawls/www.snopes.com/horrors/food/outback.asp	False	Customer becomes sick after eating a steak at a chain restaurant; analysis of her meal reveals the presence of human urine in the meat. 
/home/rob/Reference/Crawls/www.snopes.com/horrors/food/mcdshake.asp	False	McDonald's beverages contain yucky non-food substances. 
/home/rob/Reference/Crawls/www.snopes.com/horrors/food/bubbleyum.asp	False	Bubble Yum chewing gum contains spider eggs. 
/home/rob/Reference/Crawls/www.snopes.com/horrors/food/syringe.asp	False	A 1993 instance of product tampering resulted in syringes being found in cans of Pepsi. 
/home/rob/Reference/Crawls/www.snopes.com/horrors/food/menudo.asp	False	A human finger was found in a can of menudo. 
/home/rob/Reference/Crawls/www.snopes.com/horrors/food/tacobell.asp	False	The cause of swelling in a girl's jaw is determined to be cockroach eggs she got from eating a Taco Bell taco or licking envelopes.
/home/rob/Reference/Crawls/www.snopes.com/horrors/food/chili.asp	False	A patron dining at a Wendy's fast food outlet found a human finger in her bowl of chili.
/home/rob/Reference/Crawls/www.snopes.com/horrors/food/semen.asp?print=y	False	Analysis of restaurant food eaten by a young woman reveals the presence of semen from seven HIV-positive men.
/home/rob/Reference/Crawls/www.snopes.com/horrors/food/toilet.asp	Undetermined	An employee at a well-known hamburger chain in Sweden was discovered washing toilet seats in the restaurant's dishwasher. 
/home/rob/Reference/Crawls/www.snopes.com/horrors/food/chinese.asp	False	Chinese restaurants in the U.S. use cat meat in their entrees. 
/home/rob/Reference/Crawls/www.snopes.com/horrors/food/pineapple.asp	False	A child contracted AIDS through eating a pineapple that had been bled upon.
/home/rob/Reference/Crawls/www.snopes.com/horrors/food/wingcyst.asp	False	Growth hormones injected into chicken wings cause ovarian cysts in women.
/home/rob/Reference/Crawls/www.snopes.com/horrors/food/tumor.asp	False	The mayonnaise oozing from a chicken sandwich turned out to be pus from a tumor in the chicken. 
/home/rob/Reference/Crawls/www.snopes.com/horrors/food/ketchup.asp	False	HIV+ blood has been slipped into ketchup dispensers in fast food restaurants.
/home/rob/Reference/Crawls/www.snopes.com/horrors/food/semen.asp	False	Analysis of restaurant food eaten by a young woman reveals the presence of semen from seven HIV-positive men.
/home/rob/Reference/Crawls/www.snopes.com/horrors/food/chocmilk.asp	False	Chocolate milk is made from "regular" milk rejected for containing too much cow's blood. 
/home/rob/Reference/Crawls/www.snopes.com/horrors/food/evian.asp	False	Evian brand drinking water is filtered with cow's blood. 
/home/rob/Reference/Crawls/www.snopes.com/horrors/food/wormburg.asp	False	McDonald's hamburgers contain worm meat. 
/home/rob/Reference/Crawls/www.snopes.com/horrors/food/punch.asp	False	A human penis was found in a jar of fruit punch. 
/home/rob/Reference/Crawls/www.snopes.com/horrors/food/chesterfield.asp	True	A false rumor about a leper working in a cigarette factory damaged Chesterfield's sales. 
/home/rob/Reference/Crawls/www.snopes.com/horrors/food/corona.asp	False	Workers at the Corona brewery urinate into the beer. 
/home/rob/Reference/Crawls/www.snopes.com/horrors/food/kfc.asp	False	KFC no longer use the word 'chicken' to describe its product because it serves meat from genetically engineered animals that the government will no longer permit to be referred to as 'chickens.' 
/home/rob/Reference/Crawls/www.snopes.com/horrors/food/coweyes.asp	False	McDonald's is the world's largest purchaser of cow eyeballs. 
/home/rob/Reference/Crawls/www.snopes.com/horrors/food/piss.asp	True	A vengeful 
/home/rob/Reference/Crawls/www.snopes.com/horrors/ghosts/mummy.asp	False	The Titanic was sent to a watery grave because it carried a cursed mummy in its hold. 
/home/rob/Reference/Crawls/www.snopes.com/horrors/ghosts/blair.asp	False	The movie 
/home/rob/Reference/Crawls/www.snopes.com/horrors/ghosts/amityville.asp	False	
/home/rob/Reference/Crawls/www.snopes.com/horrors/ghosts/deadcall.asp	True	A man's cell phone placed calls to his loved ones after his demise.
/home/rob/Reference/Crawls/www.snopes.com/horrors/ghosts/skinned.asp	False	Ghosts of two murdered teen girls return to kill and skin parents who failed to tell their subsequent son of the girls' existence. 
/home/rob/Reference/Crawls/www.snopes.com/horrors/ghosts/winstead.asp	False	Ghost of teen who died in a sewer strikes down those who don't repost her story on MySpace.
/home/rob/Reference/Crawls/www.snopes.com/horrors/ghosts/loretto.asp	False	The spiral stairway at Santa Fe's Loretto Chapel miraculously stands despite having no discernable means of support.
/home/rob/Reference/Crawls/www.snopes.com/horrors/ghosts/jinxlimo.asp	Undetermined	The limousine Archduke Franz Ferdinand rode to his death in brought a curse upon all those who subsequently owned it. 
/home/rob/Reference/Crawls/www.snopes.com/horrors/vanities/henna.asp	True	Temporary black henna tattoos can cause permanent scarring.
/home/rob/Reference/Crawls/www.snopes.com/horrors/vanities/ribs.asp	False	Cher had her lowest pair of ribs surgically removed to achieve an ultra-small waist. 
/home/rob/Reference/Crawls/www.snopes.com/horrors/vanities/tapeworm.asp	Undetermined	Dieters used to attempt to lose weight by ingesting tapeworms. 
/home/rob/Reference/Crawls/www.snopes.com/horrors/vanities/shrink.asp	False	The purchaser of a new pair of shrink-to-fit jeans attempted to achieve the perfect skin-tight size by wearing them while soaking in a bathtub and was killed by the crushing force of the constricted pants. 
/home/rob/Reference/Crawls/www.snopes.com/horrors/vanities/tanningbed.asp	False	A woman intent upon looking her best for a big day treats herself to far too many tanning sessions and cooks herself to death. 
/home/rob/Reference/Crawls/www.snopes.com/horrors/vanities/hairdo.asp	False	When a woman with a bouffant hairdo falls victim to a mysterious illness and dies, doctors determine the cause of death to have been the bites of spiders that had taken up residence in her hair.
/home/rob/Reference/Crawls/www.snopes.com/horrors/insects/cactus.asp	False	A cactus explodes and spews baby tarantulas everywhere. 
/home/rob/Reference/Crawls/www.snopes.com/horrors/insects/telamonia.asp	False	The venomous two-striped telamonia spider lurks beneath toilet seats in public restrooms.
/home/rob/Reference/Crawls/www.snopes.com/horrors/insects/wormeye.asp	True	The larva of a human botfly was removed from a child's eye. 
/home/rob/Reference/Crawls/www.snopes.com/horrors/insects/spiderbite.asp	False	A swelling on a girl's cheek breaks open and disgorges hundreds of baby spiders.
/home/rob/Reference/Crawls/www.snopes.com/horrors/insects/stick.asp	Undetermined	Texas dog has unfortunate encounter with a walkingstick from Belize. 
/home/rob/Reference/Crawls/www.snopes.com/horrors/insects/flyboy.asp	Undetermined	An Indian boy experienced a rare condition in which beetles bred in his body and emerged from his groin as full-grown flies. 
/home/rob/Reference/Crawls/www.snopes.com/horrors/insects/bugear.asp	False	Bugs crawl into a person's ear, make their home there, then slowly eat their way through the brain. 
/home/rob/Reference/Crawls/www.snopes.com/horrors/poison/glass.asp	False	Ground glass is a deadly poison. 
/home/rob/Reference/Crawls/www.snopes.com/horrors/poison/tylenol.asp	True	Murderers have tried to pass off their crimes as copycat Tylenol poisoners. 
/home/rob/Reference/Crawls/www.snopes.com/horrors/poison/halloween.asp	False	Police have documented cases of madmen  randomly distributing poisoned goodies to children on Halloween.
/home/rob/Reference/Crawls/www.snopes.com/horrors/poison/envelope.asp	False	People have been killed by cyanide-laced ATM deposit envelopes. 
/home/rob/Reference/Crawls/www.snopes.com/horrors/poison/golftee.asp	True	A golfer in the habit of carrying his tee in his mouth while playing holes grows sicker and sicker over the course of a few days and then drops dead. A post-mortem reveals that the golfer had ingested a lethal dose of the pesticide sprayed on the golf course. 
/home/rob/Reference/Crawls/www.snopes.com/horrors/poison/cokecan.asp?print=y	False	A child died from drinking the contents of a prize-bearing Coca-Cola 'MagiCan.' 
/home/rob/Reference/Crawls/www.snopes.com/horrors/poison/coolidge.asp	False	President Calvin Coolidge's son was killed by the poisonous dye in his black socks. 
/home/rob/Reference/Crawls/www.snopes.com/horrors/poison/cokecan.asp	False	A child died from drinking the contents of a prize-bearing Coca-Cola 'MagiCan.' 
/home/rob/Reference/Crawls/www.snopes.com/horrors/robbery/purse.asp	False	Women who wear their purses strapped across their bodies running the risk of being beheaded by purse snatchers. 
/home/rob/Reference/Crawls/www.snopes.com/horrors/robbery/kidney2.asp	False	A fun-loving college student awoke after a wild party to find both his kidneys had been stolen by organ thieves. He now spends his days attached to a machine that keeps him alive until a donor match can be found. 
/home/rob/Reference/Crawls/www.snopes.com/horrors/robbery/kidney.asp	False	Drugged travelers awaken in ice-filled bathtubs only to discover one of their kidneys has been harvested by organ thieves. 
/home/rob/Reference/Crawls/www.snopes.com/horrors/robbery/slasher.asp	False	Thieves lie in wait under victims' cars, then render their victims helpless by slashing their ankles. 
/home/rob/Reference/Crawls/www.snopes.com/horrors/robbery/roommenu.asp	Undetermined	A woman traveling on business almost becomes a crime statistic because she filled out a room service menu. 
/home/rob/Reference/Crawls/www.snopes.com/horrors/animals/golfcroc.asp	False	A Palm Beach golfer was devoured by a large crocodile right on the links. 
/home/rob/Reference/Crawls/www.snopes.com/horrors/animals/anaconda.asp	False	A South American camper was eaten by an anaconda. 
/home/rob/Reference/Crawls/www.snopes.com/horrors/animals/snowball.asp	True	An abused goat kills its 
/home/rob/Reference/Crawls/www.snopes.com/horrors/mayhem/needles.asp	True	Pins, needles, and razor blades have been found in trick-or-treaters' loot.
/home/rob/Reference/Crawls/www.snopes.com/horrors/mayhem/payphone2.asp	False	Gang members all over the country are spreading a deadly mixture of LSD and strychnine on pay phone buttons. 
/home/rob/Reference/Crawls/www.snopes.com/horrors/mayhem/payphone.asp	False	Drug users are disposing of their used needles by putting them into the coin return slots of public telephones, thereby infecting unsuspecting victims with hepatitis and HIV. 
/home/rob/Reference/Crawls/www.snopes.com/horrors/mayhem/spunkball.asp	False	Teens across the U.S.A. are amusing themselves by throwing lit gasoline-soaked rags into cars halted at stop lights. 
/home/rob/Reference/Crawls/www.snopes.com/horrors/mayhem/gaspump.asp	False	Service station customers are getting stuck by HIV-loaded syringes affixed to gas pump handles.
/home/rob/Reference/Crawls/www.snopes.com/horrors/mayhem/haunted.asp	False	Somewhere in the U.S. is a famed haunted house attraction so scary that no visitor has ever completed a tour of it.
/home/rob/Reference/Crawls/www.snopes.com/horrors/mayhem/slicer.asp	False	Zero Population Growth terrorists have taken to boobytrapping toilets in men's restrooms. 
/home/rob/Reference/Crawls/www.snopes.com/horrors/traffic/siblings.asp	True	Siblings are coincidentally killed in related automobile accidents.
/home/rob/Reference/Crawls/www.snopes.com/horrors/cannibal/fetus.asp	False	Taiwan's hottest restaurants offer grilled and barbequed fetuses.
/home/rob/Reference/Crawls/www.snopes.com/horrors/gruesome/leafpile.asp	True	A father parks his truck atop a leaf pile containing his daughter, killing her.
/home/rob/Reference/Crawls/www.snopes.com/horrors/gruesome/fecalcolon.asp	False	John Wayne's autopsy revealed 40 pounds of impacted fecal matter lodged in his colon.
/home/rob/Reference/Crawls/www.snopes.com/horrors/gruesome/buried.asp	True	People have been buried alive by mistake. 
/home/rob/Reference/Crawls/www.snopes.com/horrors/gruesome/headless.asp	True	A cuckolded husband presented his wife with the head of her lover.
/home/rob/Reference/Crawls/www.snopes.com/horrors/gruesome/mccurdy.asp	True	The "hanging man" in a funhouse turns out to be the corpse of an outlaw. 
/home/rob/Reference/Crawls/www.snopes.com/horrors/gruesome/fivedays.asp	False	A man who died at his office desk went unnoticed by his co-workers for five days. 
/home/rob/Reference/Crawls/www.snopes.com/horrors/gruesome/hanging.asp	True	A suicide by hanging was mistaken for a Halloween decoration. 
/home/rob/Reference/Crawls/www.snopes.com/horrors/gruesome/lostwreck.asp	True	The clanging of rock on metal leads a work crew to discover a decades-old wrecked car ? with four skeletons inside ? a few hundred feet off the road.
/home/rob/Reference/Crawls/www.snopes.com/horrors/gruesome/challenger.asp	False	A secret tape recorded aboard the doomed shuttle Challenger captured the final panic-stricken moments of the crew. 
/home/rob/Reference/Crawls/www.snopes.com/horrors/gruesome/bodybed.asp	True	After repeatedly complaining about the smell in their room, a couple staying in a hotel discovers the body of a murdered girl under their bed. 
/home/rob/Reference/Crawls/www.snopes.com/horrors/drugs/deadbaby.asp	False	Drug dealers use hollowed-out bodies of dead children to smuggle cocaine into the United States. 
/home/rob/Reference/Crawls/www.snopes.com/horrors/drugs/linkletter.asp	False	Thinking she could fly, Diane Linkletter accidentally jumped to her death while high on LSD.
/home/rob/Reference/Crawls/www.snopes.com/horrors/drugs/bluestar.asp	False	Rub-on "tattoos" of cartoon characters laced with LSD are handed out to children by unscrupulous drug dealers. 
/home/rob/Reference/Crawls/www.snopes.com/horrors/drugs/suckers.asp	Multiple &mdash; see below:	Drug-laced suckers are being handed out to children in Arkansas.
/home/rob/Reference/Crawls/www.snopes.com/horrors/drugs/candymeth.asp	Partly true	Drug dealers are selling colored crystal methamphetamine known as "Strawberry Quick." 
/home/rob/Reference/Crawls/www.snopes.com/horrors/drugs/lsdsun.asp	False	Several students tripping on LSD stared at the sun until blinded. 
/home/rob/Reference/Crawls/www.snopes.com/horrors/drugs/facepeel.asp	Undetermined	Man high on drugs slices off pieces of his face and feeds them to his dogs. 
/home/rob/Reference/Crawls/www.snopes.com/horrors/freakish/darwin03.asp	A number of real entries, one unknown, and one fiction	Internet-circulated list entitled "2003 Darwin Awards" details actual deaths.
/home/rob/Reference/Crawls/www.snopes.com/horrors/freakish/laughing.asp	True	People have died laughing. 
/home/rob/Reference/Crawls/www.snopes.com/horrors/freakish/saguaro.asp	True	A damaged cactus falls onto the man who had harmed it, killing him. 
/home/rob/Reference/Crawls/www.snopes.com/horrors/freakish/poprocks.asp?print=y	False	Little Mikey of LIFE cereal fame died from the explosive effects of mixing Pop Rocks candy with soda pop. 
/home/rob/Reference/Crawls/www.snopes.com/horrors/freakish/hoover.asp	False	Bodies of workmen are entombed in Hoover Dam.
/home/rob/Reference/Crawls/www.snopes.com/horrors/freakish/scuba.asp	False	The charred remains of a scuba diver were discovered in a tree after a forest fire. 
/home/rob/Reference/Crawls/www.snopes.com/horrors/freakish/trombone.asp	False	A band musician received a fatal head injury from a trombone slide.
/home/rob/Reference/Crawls/www.snopes.com/horrors/freakish/dancer.asp	False	Kid dies doing the latest dance step in a video.
/home/rob/Reference/Crawls/www.snopes.com/horrors/freakish/smother.asp	True	An eruption of carbon dioxide from a lake killed hundreds of people.
/home/rob/Reference/Crawls/www.snopes.com/horrors/freakish/darwin05.asp	One real entry, some unknowns, and some fictions	Internet-circulated list entitled "2005 Darwin Awards" details actual demises.
/home/rob/Reference/Crawls/www.snopes.com/horrors/freakish/fakehang.asp	Undetermined	A miscreant who attempted to rip off the home of a dead man paid for the crime with his life when the shock of being kicked by the "corpse" was enough to bring on a fatal heart attack. 
/home/rob/Reference/Crawls/www.snopes.com/horrors/freakish/cleaner.asp	False	An inattentive janitor caused death in a South African hospital every Friday when she unplugged patients' life support systems to plug in her floor polisher. 
/home/rob/Reference/Crawls/www.snopes.com/horrors/freakish/mentos.asp?print=y	False	A mixture of Mentos and Coca-Cola killed two Brazilian children.
/home/rob/Reference/Crawls/www.snopes.com/horrors/freakish/window.asp	True	A lawyer demonstrating the safety of windows in a skyscraper crashed through a pane and plunged to his death.
/home/rob/Reference/Crawls/www.snopes.com/horrors/freakish/lawnmower.asp	True	A spectator at a football game was killed by a flying model lawnmower.
/home/rob/Reference/Crawls/www.snopes.com/horrors/freakish/hotspring.asp	True	Man is burned to death attempting to rescue dog from boiling hot spring. 
/home/rob/Reference/Crawls/www.snopes.com/horrors/freakish/onstage.asp	True	Several actors have kicked the bucket in front of an audience. 
/home/rob/Reference/Crawls/www.snopes.com/horrors/freakish/darwin06.asp	Multiple &mdash; see below	Internet-circulated list titled "2006 Darwin Awards" details actual deaths.
/home/rob/Reference/Crawls/www.snopes.com/horrors/freakish/laundry.asp	False	A Virginia man was washing machined to death. 
/home/rob/Reference/Crawls/www.snopes.com/horrors/freakish/lasvegas.asp	True	A tourist was electrocuted while crossing a street in Las Vegas. 
/home/rob/Reference/Crawls/www.snopes.com/horrors/freakish/poprocks.asp	False	Little Mikey of LIFE cereal fame died from the explosive effects of mixing Pop Rocks candy with soda pop. 
/home/rob/Reference/Crawls/www.snopes.com/horrors/freakish/pump.asp	False	The latest thrill in Thailand ? pumping air into the rectum with a bicycle pump ? is claiming victims at an alarming rate. 
/home/rob/Reference/Crawls/www.snopes.com/horrors/freakish/houdini.asp	False	Escape artist Harry Houdini died from a ruptured appendix caused by his being punched in the stomach by a college student.
/home/rob/Reference/Crawls/www.snopes.com/horrors/freakish/opus.asp	False	Murder or suicide? The coroner had his hands full determining just that, in the case of a man who jumped off a building only to have a shotgun blast finish him off halfway down. 
/home/rob/Reference/Crawls/www.snopes.com/horrors/freakish/quake.asp	False	After the 1989 Loma Prieta quake, a car thief was found crushed to death under a collapsed freeway overpass in the vehicle he'd stolen. 
/home/rob/Reference/Crawls/www.snopes.com/horrors/freakish/darwin04.asp	One real entry, the others are fiction	Internet-circulated list titled "2004 Darwin Awards" details actual demises.
/home/rob/Reference/Crawls/www.snopes.com/horrors/freakish/hippoeatsdwarf.asp	False	A circus dwarf died when he bounced off a trampoline into the mouth of a hippopotamus.
/home/rob/Reference/Crawls/www.snopes.com/horrors/freakish/hanging.asp	True	A young man was hanged for real when a Halloween show stunt went wrong.
/home/rob/Reference/Crawls/www.snopes.com/horrors/freakish/beer.asp	True	Nine people died in a beer flood in 1814. 
/home/rob/Reference/Crawls/www.snopes.com/horrors/freakish/kogut.asp	True	A prisoner killed himself using a deck of playing cards. 
/home/rob/Reference/Crawls/www.snopes.com/horrors/freakish/griffin.asp	False	John Howard Griffin, the author of 
/home/rob/Reference/Crawls/www.snopes.com/horrors/freakish/elevator.asp	True	A Houston doctor was decapitated by an elevator.
/home/rob/Reference/Crawls/www.snopes.com/horrors/freakish/lollipop.asp	False	A man eating a lollipop choked to death when his car's airbag deployed, forcing the candy down his throat. 
/home/rob/Reference/Crawls/www.snopes.com/horrors/freakish/lavalamp.asp	True	A man was killed by an exploding lava lamp.
/home/rob/Reference/Crawls/www.snopes.com/horrors/freakish/stripper.asp	False	A groom was suffocated by a stripper's massive breasts. 
/home/rob/Reference/Crawls/www.snopes.com/horrors/freakish/mentos.asp	False	A mixture of Mentos and Coca-Cola killed two Brazilian children.
/home/rob/Reference/Crawls/www.snopes.com/horrors/madmen/snuff.asp	False	Films are routinely made for entertainment purposes in which participants are murdered on camera. 
/home/rob/Reference/Crawls/www.snopes.com/horrors/madmen/mallgrab.asp	False	Women are being lured out of malls and into dangerous situations with the promise of appearing in television commericals. 
/home/rob/Reference/Crawls/www.snopes.com/horrors/madmen/balcony.asp	False	Young girls are tripped by a stranger and sent plummeting to their deaths from theater balconies. 
/home/rob/Reference/Crawls/www.snopes.com/horrors/madmen/slavemaster.asp	Was true; now outdated	A man using the screen name 'Slavemaster' is luring women to their deaths over the Internet.
/home/rob/Reference/Crawls/www.snopes.com/horrors/madmen/fakestop.asp	True	Woman fabricates story about being detained by a man pretending to be a police officer. 
/home/rob/Reference/Crawls/www.snopes.com/horrors/madmen/doom.asp	False	One of the boys who murdered his classmates at Columbine High School prepared by designing new computer game levels that resembled his school and peopling them with representations of his classmates.
/home/rob/Reference/Crawls/www.snopes.com/horrors/madmen/housekey.asp	False	Women who leave their cars to be serviced risk rape from mechanics who copy their house keys with a view to breaking in later. 
/home/rob/Reference/Crawls/www.snopes.com/horrors/madmen/webkinz.asp	False	Children's Webkinz are being murdered online.
/home/rob/Reference/Crawls/www.snopes.com/horrors/madmen/pinprick.asp	False	AIDS-infected blood is being injected into unsuspecting moviegoers and young people dancing in bars or at raves.
/home/rob/Reference/Crawls/www.snopes.com/horrors/madmen/campus.asp	
False	A psychic predicted on a popular television talk show that a mass murder would take place on Halloween at a college campus. 
/home/rob/Reference/Crawls/www.snopes.com/horrors/parental/backover.asp	False	Parents of a murdered Virginia Tech co-ed unthinkingly back over another of their children on the way to the airport.
