/home/rob/Reference/Crawls/www.snopes.com/luck/pele.asp?print=y	True	Tourists who have taken rocks from Hawaiian beaches have returned them in hopes of ending streaks of bad luck.
/home/rob/Reference/Crawls/www.snopes.com/luck/teacher.asp?print=y	False	The same woman who was originally scheduled to be part of the Challenger shuttle crew in 1986 was also bumped off the ill-fated Columbia mission in 2003.
/home/rob/Reference/Crawls/www.snopes.com/luck/cookie.asp?print=y	True	Numbers recommended by a fortune cookie resulted in a lottery win.
/home/rob/Reference/Crawls/www.snopes.com/luck/lottery.asp	True	A policeman promised a waitress half the winnings from his lottery ticket. All the numbers came up, and he kept his word by sharing the jackpot with her.
/home/rob/Reference/Crawls/www.snopes.com/luck/einstein.asp?print=y	Undetermined	Nick "the Greek" Dandalos had an unusual way of introducing Albert Einstein around Las Vegas.
/home/rob/Reference/Crawls/www.snopes.com/luck/lottery.asp?print=y	True	A policeman promised a waitress half the winnings from his lottery ticket. All the numbers came up, and he kept his word by sharing the jackpot with her.
/home/rob/Reference/Crawls/www.snopes.com/luck/pele.asp	True	Tourists who have taken rocks from Hawaiian beaches have returned them in hopes of ending streaks of bad luck.
/home/rob/Reference/Crawls/www.snopes.com/luck/lottosuicide.asp	True	A man committed suicide because he mistakenly believed his lotto numbers had come up the one week he didn't play them.
/home/rob/Reference/Crawls/www.snopes.com/luck/dead.asp?print=y	True	A lottery winner was run over by a truck just hours after his win.
/home/rob/Reference/Crawls/www.snopes.com/luck/trumptip.asp	False	Donald Trump left a Buffalo Club waiter a $10,000 tip.
/home/rob/Reference/Crawls/www.snopes.com/luck/lottery/dreamwin.asp?print=y	True	Woman wins lottery twice after dreaming about the winning combination.
/home/rob/Reference/Crawls/www.snopes.com/luck/lottery/dreamwin.asp	True	Woman wins lottery twice after dreaming about the winning combination.
/home/rob/Reference/Crawls/www.snopes.com/luck/casino.asp	False	Casinos pump extra oxygen onto the gaming floors during the early-morning hours to keep tired patrons from heading off to bed. 
/home/rob/Reference/Crawls/www.snopes.com/luck/discoveries/sapphire.asp?print=y	Partly true	Rock purchased for $10 proves to be a valuable star sapphire.
/home/rob/Reference/Crawls/www.snopes.com/luck/discoveries/sapphire.asp	Partly true	Rock purchased for $10 proves to be a valuable star sapphire.
/home/rob/Reference/Crawls/www.snopes.com/luck/einstein.asp	Undetermined	Nick "the Greek" Dandalos had an unusual way of introducing Albert Einstein around Las Vegas.
/home/rob/Reference/Crawls/www.snopes.com/luck/shoeless.asp	Undetermined	An unkempt, filthy, shoeless bum turned a 
/home/rob/Reference/Crawls/www.snopes.com/luck/royal.asp	Multiple:	Hapless video poker player who was dealt a royal flush lost his jackpot because he failed to mark all the cards as held before pushing the "Deal" button.
/home/rob/Reference/Crawls/www.snopes.com/luck/megabucks.asp	False	Soon after winning the largest-ever Megabucks slots jackpot, the new multi-millionaire died a violent death.
/home/rob/Reference/Crawls/www.snopes.com/luck/casino.asp?print=y	False	Casinos pump extra oxygen onto the gaming floors during the early-morning hours to keep tired patrons from heading off to bed. 
/home/rob/Reference/Crawls/www.snopes.com/luck/lottosuicide.asp?print=y	True	A man committed suicide because he mistakenly believed his lotto numbers had come up the one week he didn't play them.
/home/rob/Reference/Crawls/www.snopes.com/luck/choir.asp	True	When a Nebraska church exploded in 1950, no one was injured because every member of the choir was late arriving for practice that evening. 
/home/rob/Reference/Crawls/www.snopes.com/luck/declare.asp	True	A lucky bargain hunter became a millionaire after finding an original print of the Declaration of Independence in the frame of an old painting.
/home/rob/Reference/Crawls/www.snopes.com/luck/cookie.asp	True	Numbers recommended by a fortune cookie resulted in a lottery win.
/home/rob/Reference/Crawls/www.snopes.com/luck/trump.asp?print=y	False	A stranger who stopped to change a tire on a disabled limo was rewarded for his efforts when the vehicle's passenger, Donald Trump, paid off his mortgage. 
/home/rob/Reference/Crawls/www.snopes.com/luck/trump.asp	False	A stranger who stopped to change a tire on a disabled limo was rewarded for his efforts when the vehicle's passenger, Donald Trump, paid off his mortgage. 
/home/rob/Reference/Crawls/www.snopes.com/luck/monte.asp	True	In 1873 a British mill engineer "broke the bank" at a Monte Carlo casino.
/home/rob/Reference/Crawls/www.snopes.com/luck/royal.asp?print=y	Multiple:	Hapless video poker player who was dealt a royal flush lost his jackpot because he failed to mark all the cards as held before pushing the "Deal" button.
/home/rob/Reference/Crawls/www.snopes.com/luck/teacher.asp	False	The same woman who was originally scheduled to be part of the Challenger shuttle crew in 1986 was also bumped off the ill-fated Columbia mission in 2003.
/home/rob/Reference/Crawls/www.snopes.com/luck/choir.asp?print=y	True	When a Nebraska church exploded in 1950, no one was injured because every member of the choir was late arriving for practice that evening. 
/home/rob/Reference/Crawls/www.snopes.com/luck/married.asp?print=y	True	A husband and wife each won a lottery by playing numbers recommended by a fortune cookie.
/home/rob/Reference/Crawls/www.snopes.com/luck/declare.asp?print=y	True	A lucky bargain hunter became a millionaire after finding an original print of the Declaration of Independence in the frame of an old painting.
/home/rob/Reference/Crawls/www.snopes.com/crime/justice/grambo.asp	False	A gun-toting Australian granny blew the testicles off the two men who raped her granddaughter.
/home/rob/Reference/Crawls/www.snopes.com/crime/fraud/reshipper.asp	Real fraud which costs its victims thousands of dollars	Aspiring work-at-homers promised big bucks for acting as intermediaries for international transactions wherein they cash checks for other parties have been defrauded by con artists.
/home/rob/Reference/Crawls/www.snopes.com/crime/safety/lowbattery.asp	True	Some older model cordless phones call 911 by themselves when their batteries are dying.
/home/rob/Reference/Crawls/www.snopes.com/crime/safety/response.asp	Multiple &mdash; see below	Man who can't motivate police to investigate a break-in reports a more serious crime instead. 
/home/rob/Reference/Crawls/www.snopes.com/crime/cops/judd.asp	True	Sheriff attributes suspect's being shot 68 times to that being "all the bullets we had."
/home/rob/Reference/Crawls/www.snopes.com/crime/cops/dea.asp	False	The DEA has been erecting billboards announcing an upcoming crackdown on the drug supply. 
/home/rob/Reference/Crawls/www.snopes.com/crime/cops/burger.asp	Undetermined	Woman calls police because a fast food outlet won't make a cheeseburger the way she wants it.
/home/rob/Reference/Crawls/www.snopes.com/crime/mootloot/radio.asp	True	Mistaken belief that radios in Ford automobiles contain chips that pick up satellite TV spurs car vandals.
/home/rob/Reference/Crawls/www.snopes.com/crime/deserts/streaker.asp	True	Three streakers had their car stolen while they were running nude through a restaurant. 
/home/rob/Reference/Crawls/www.snopes.com/crime/prevent/ninetips.asp	Multiple &mdash; see below	Nine safety tips e-mail offers effective counters to being victimized in random violent crime.
/home/rob/Reference/Crawls/www.snopes.com/crime/prevent/rape.asp	False	Heeding the advice given in a popular e-mail missive will keep you from becoming a rape victim.
/home/rob/Reference/Crawls/www.snopes.com/crime/prevent/doorpound.asp	True	Home invasion criminals have gained entry to houses by pretending to be distressed persons in need of shelter from attackers.
/home/rob/Reference/Crawls/www.snopes.com/crime/prevent/cellping.asp	Partly true	Enabling your cell phone's "Location On" feature can assist emergency services in reaching you. 
/home/rob/Reference/Crawls/www.snopes.com/crime/prevent/caralarm.asp	Multiple &mdash; see below	If you think your house is being burglarized, you should use your car alarm to summon help. 
/home/rob/Reference/Crawls/www.snopes.com/crime/prevent/icephone.asp	Multiple &mdash; see below:	Paramedic advocates cell phone users store emergency contact information in their address books, but such entries leave phones vulnerable to attack.
/home/rob/Reference/Crawls/www.snopes.com/crime/prevent/celltheft.asp	Partially true	Pressing a sequence of keys on your cell phone will produce a serial number that can be used to disable it in case of theft.
/home/rob/Reference/Crawls/www.snopes.com/crime/clever/cigarson.asp	False	A cigar aficionado insures his stogies against fire, then tries to collect from his insurance company after he smokes them. 
/home/rob/Reference/Crawls/www.snopes.com/crime/clever/bleach.asp	False	Drinking bleach can help a drug user beat drug testing.
/home/rob/Reference/Crawls/www.snopes.com/crime/clever/thanks.asp	True	After successfully robbing a bank, very polite Japanese thieves penned a thank-you note to that financial institution.
/home/rob/Reference/Crawls/www.snopes.com/crime/gangs/pullover.asp	False	Gang initiates flash their headlights to get cars to pull over in order to murder their occupants.
/home/rob/Reference/Crawls/www.snopes.com/crime/gangs/genesee.asp	False	Detroit-area gang initiates are planning to shoot a woman in the head at a gas station in Genesee County.
/home/rob/Reference/Crawls/www.snopes.com/crime/gangs/brick.asp	False	Gang members in Oklahoma City looking to rob or kill random victims throw rocks or bricks at cars in hope of getting motorists to stop.
/home/rob/Reference/Crawls/www.snopes.com/crime/gangs/carbump.asp	False	Gang initiates are bumping their cars into others, then shooting whoever gets out of the bumped automobiles.
/home/rob/Reference/Crawls/www.snopes.com/crime/gangs/chased.asp	False	Gang initiates are attempting to force cars off roads in order to murder the occupants.
/home/rob/Reference/Crawls/www.snopes.com/crime/gangs/macon.asp	False	Gang initiates in Macon, Georgia, must shoot a white female at the Macon Mall.
/home/rob/Reference/Crawls/www.snopes.com/crime/gangs/dalton.asp	False	The Dalton (Georgia) police have warned local stores to be on the alert for gang initiation abductions.
/home/rob/Reference/Crawls/www.snopes.com/crime/gangs/directions.asp	False	Gang initiates ask women for directions, then shoot them.
/home/rob/Reference/Crawls/www.snopes.com/crime/gangs/walmart.asp	False	Gang initiates must assault or kill a woman, a small child, or an elderly person at a 
/home/rob/Reference/Crawls/www.snopes.com/crime/gangs/doorknock.asp	False	Gang initiates in the Dallas area are knocking on the doors of residences and shooting whoever answers.
/home/rob/Reference/Crawls/www.snopes.com/crime/gangs/buckfifty.asp	False	Gang initiates in New Jersey are slashing victims' faces to "get a buck fifty." 
/home/rob/Reference/Crawls/www.snopes.com/crime/gangs/tshirt.asp	Undetermined	The Mexican Mafia is retaliating for a drug theft by killing 400 to 1,000 black men wearing white 
/home/rob/Reference/Crawls/www.snopes.com/crime/intent/adthief.asp	True	Burglars check newspaper obituaries so they can clean out homes while the residents are away attending funerals. 
/home/rob/Reference/Crawls/www.snopes.com/crime/intent/reply.asp	False	Thieves are stealing computer lists of "out of office" auto-replies to target homes for burglary. 
/home/rob/Reference/Crawls/www.snopes.com/crime/warnings/stallings.asp	False	Michigan state police have issued a warning about an online predator named Jason Stallings. 
/home/rob/Reference/Crawls/www.snopes.com/crime/warnings/bumpkeys.asp	True	Some residence locks are vulnerable to unauthorized entry through the use of "bump keys."
/home/rob/Reference/Crawls/www.snopes.com/crime/warnings/montgomery.asp	False	Gang initiates in Montgomery, Alabama, are sneaking into cars at service stations and raping white female motorists.
/home/rob/Reference/Crawls/www.snopes.com/crime/warnings/sugared.asp	False	Assailant disables woman's car by putting sugar water in her gas tank, causing the vehicle to die in an isolated location.
/home/rob/Reference/Crawls/www.snopes.com/crime/warnings/restroom.asp	False	Thieves who work shopping malls are robbing women in washrooms and leaving them naked.
/home/rob/Reference/Crawls/www.snopes.com/crime/warnings/puncture.asp	False	Thieves at shopping malls are placing sharpened spikes up against the tires of shoppers' vehicles with an eye to disabling these vehicles and robbing shoppers who are attempting to drive home.
/home/rob/Reference/Crawls/www.snopes.com/crime/warnings/methtank.asp	Multiple:	Propane tanks used in the manufacture of methamphetamine are being returned to stores and resold.
/home/rob/Reference/Crawls/www.snopes.com/crime/warnings/jostle.asp	Can and has happened at some ATMs	ATM users in the UK are robbed by newspaper distributors who jostle their victims during transactions
/home/rob/Reference/Crawls/www.snopes.com/crime/warnings/injection.asp	Undetermined	A woman in UK was jabbed with an unknown substance by a panhandler.
/home/rob/Reference/Crawls/www.snopes.com/crime/warnings/vacaville.asp	False	E-mail describes an attempted rape in Vacaville, California.
/home/rob/Reference/Crawls/www.snopes.com/crime/warnings/nohead.asp	Undetermined	Several homicides in the Florida/Georgia area are all the work of a single serial killer who dismembers his victims.
/home/rob/Reference/Crawls/www.snopes.com/crime/warnings/childlure.asp	False	Rapists are using little children who appear to be lost to lure victims to them.
/home/rob/Reference/Crawls/www.snopes.com/crime/warnings/roundrock.asp	Undetermined	Groups of gang members are committing robberies and carjackings in Round Rock, Texas. 
/home/rob/Reference/Crawls/www.snopes.com/crime/warnings/crybaby.asp	False	A serial killer is luring women from their homes by playing a recording of a crying baby.
/home/rob/Reference/Crawls/www.snopes.com/crime/warnings/drunk.asp	False	A man in Chattanooga pretending to be drunk fools women drivers into thinking they've hit him as a method of luring them from their vehicles.
/home/rob/Reference/Crawls/www.snopes.com/crime/warnings/creditcard.asp	True	Scammers pretend to be fraud investigation agents for Visa and MasterCard in order to obtain credit card security codes.
/home/rob/Reference/Crawls/www.snopes.com/crime/warnings/border.asp	False	Smugglers are hiding drugs in Canadian vehicles parked at U.S. shopping malls, then following them across the border.
/home/rob/Reference/Crawls/www.snopes.com/crime/warnings/jenkem.asp	False	Bulletin warns that a new drug called Jenkem, made by fermenting raw sewage, is a "popular drug in American schools."
/home/rob/Reference/Crawls/www.snopes.com/crime/warnings/saginaw.asp	False	An abduction attempt was foiled at a Wal-Mart in Saginaw, Texas.
/home/rob/Reference/Crawls/www.snopes.com/crime/warnings/keyring.asp	False	Criminals at gas stations are handing out key rings with transmitters that enable them to track potential burglary or carjacking victims.
/home/rob/Reference/Crawls/www.snopes.com/crime/warnings/mirror.asp	False	Looking for the absence of a gap between an object and its reflection is the best way to distinguish two-way mirrors from ordinary mirrors. 
/home/rob/Reference/Crawls/www.snopes.com/crime/warnings/sniper.asp	Undetermined	E-mail offers sniper-avoidance tips from an experienced "SWAT sniper." 
/home/rob/Reference/Crawls/www.snopes.com/crime/warnings/maryland.asp	False	Maryland gangs are engaging in a deadly initiation game that requires new members to steal cars and shoot motorists on highways.
/home/rob/Reference/Crawls/www.snopes.com/crime/warnings/cellgun.asp	True	Police have discovered guns disguised as cell phones.
/home/rob/Reference/Crawls/www.snopes.com/crime/warnings/checktheft.asp	Multiple &mdash; see below	Memo from Louisiana government official warns about a Wal-Mart check theft ring.
/home/rob/Reference/Crawls/www.snopes.com/crime/warnings/kryptonite.asp	True	Kryptonite brand locks can be picked with ordinary Bic pens.
/home/rob/Reference/Crawls/www.snopes.com/crime/warnings/carbump.asp	Was true &mdash; now outdated	Houston police are looking for robbers who use their vehicles to bump the cars of their victims.
/home/rob/Reference/Crawls/www.snopes.com/crime/warnings/garland.asp	False	A woman was robbed at a Wal-Mart in Garland, Texas, by a thief who injected her with an unknown substance.
/home/rob/Reference/Crawls/www.snopes.com/crime/warnings/phonecam.asp	Undetermined	Thieves are using camera cell phones to capture credit card information. 
/home/rob/Reference/Crawls/www.snopes.com/crime/warnings/hotelkey.asp	False	Hotel room keycards are routinely encoded with personal information which can be easily harvested by thieves. 
/home/rob/Reference/Crawls/www.snopes.com/crime/warnings/cardscams.asp	Possible, but not common	E-mail chronicles various ways scammers might obtain your credit card numbers.
/home/rob/Reference/Crawls/www.snopes.com/crime/warnings/walmart.asp	False	Woman narrowly escapes abduction attempt in the parking lot of a Cedar Falls 
/home/rob/Reference/Crawls/www.snopes.com/crime/warnings/perfume.asp	False	Robbers in shopping mall parking lots are using ether-filled perfume bottles to render their victims unconscious.
/home/rob/Reference/Crawls/www.snopes.com/crime/warnings/wichita.asp	Partly true	E-mail describes an attempted robbery at a Wichita, Kansas, convenience store.
/home/rob/Reference/Crawls/www.snopes.com/crime/warnings/trainwreck.asp	False	E-mail describes a case of three women being slipped Rohypnol by a 
/home/rob/Reference/Crawls/www.snopes.com/crime/warnings/batonrouge.asp	False	A serial killer/rapist is luring women with $5 bills they've 'dropped.' 
/home/rob/Reference/Crawls/www.snopes.com/crime/warnings/vin.asp	Multiple:	Thieves can steal cars by using VINs to obtain duplicate keys through auto dealerships.
/home/rob/Reference/Crawls/www.snopes.com/crime/warnings/wheaton.asp	False	An abductor prowling a Target parking lot in  Wheaton, Illinois, uses an old lady in distress to lure female victims.
/home/rob/Reference/Crawls/www.snopes.com/crime/warnings/acidbomb.asp	True	E-mail describes an "acid bomb" left to explode on a residential porch.
/home/rob/Reference/Crawls/www.snopes.com/crime/statistics/ausguns.asp	Multiple - see below	Statistics demonstrate that crime rates in Australia have increased substantially since the government there instituted a gun buy-back program in 1997. 
/home/rob/Reference/Crawls/www.snopes.com/crime/statistics/superbowl.asp	False	More women are victims of domestic violence on Super Bowl Sunday than on any other day of the year.
/home/rob/Reference/Crawls/www.snopes.com/crime/dumdum/gunshop.asp	True	Thief who tries to rob a gun shop is shot dead by those in the store.
/home/rob/Reference/Crawls/www.snopes.com/crime/dumdum/911.asp	True	Criminals have unintentionally turned themselves in by calling 911.
/home/rob/Reference/Crawls/www.snopes.com/business/deals/bananas.asp	True	A store made good on its offer to sell stereos for "299 bananas" when customers proffered the fruit as payment. 
/home/rob/Reference/Crawls/www.snopes.com/business/deals/pudding.asp	True	A clever consumer earned a lifetime of free air travel by taking advantage of a Healthy Choice pudding promotion.
/home/rob/Reference/Crawls/www.snopes.com/business/deals/porsche.asp	
False	Porsche dealer offers "buy one, get one free" promotion.
/home/rob/Reference/Crawls/www.snopes.com/business/deals/hummer.asp	True	A woman sued a radio station when the Hummer she won in their contest turned out to be a toy rather than a full-sized vehicle.
/home/rob/Reference/Crawls/www.snopes.com/business/deals/pepsijet.asp	False	A jocular Pepsi "offer" obligated them to provide a $33.8 million Harrier jet to a consumer who claimed it for $700,000.
/home/rob/Reference/Crawls/www.snopes.com/business/deals/carnation.asp	False	Woman wins $1,000 in a Carnation Milk slogan contest by submitting a bawdy bit of verse.
/home/rob/Reference/Crawls/www.snopes.com/business/taxes/blacktax.asp	False	African-Americans are entitled to a $5,000 slavery reparation tax credit.
/home/rob/Reference/Crawls/www.snopes.com/business/taxes/woolworth.asp	True	The number on a sample Social Security card distributed in wallets sold through Woolworth stores was used by thousands of people.
/home/rob/Reference/Crawls/www.snopes.com/business/taxes/blackssn.asp	False	The U.S. government assigns Social Security numbers on the basis of race, a practice that permits employers to screen applicants and weed out those of color.
/home/rob/Reference/Crawls/www.snopes.com/business/taxes/excise.asp	True	Special one-time federal excise tax credit in 2006 rebates tax overpayment on phone bills.
/home/rob/Reference/Crawls/www.snopes.com/business/taxes/takemykids.asp	True	A man angered by the IRS's refusal to allow deductions for all three of his children threatened to turn the raising of two of them over to the government.
/home/rob/Reference/Crawls/www.snopes.com/business/taxes/bill602p.asp	False	The U.S. Postal Service is going to impose a 5? surcharge on every 
/home/rob/Reference/Crawls/www.snopes.com/business/taxes/immigrants.asp	False	The U.S. government grants a seven-year tax holiday to certain favored groups of immigrants and provides them with free housing, new cars, and clothing allowances as well.
/home/rob/Reference/Crawls/www.snopes.com/business/taxes/taxlabel.asp	False	You can slip out of the IRS' audit stream by not using the preprinted labels supplied with your income tax forms.  
/home/rob/Reference/Crawls/www.snopes.com/business/taxes/dependents.asp	True	Several million fewer dependents were claimed on federal income tax returns the year the IRS started requiring taxpayers to list the Social Security numbers of their children.
/home/rob/Reference/Crawls/www.snopes.com/business/alliance/inandout.asp	True	Cups and burger wrappers at In-N-Out Burger are marked with Bible citations.
/home/rob/Reference/Crawls/www.snopes.com/business/alliance/troop.asp	False	Troop clothing is owned by the KKK, and the name stands for "To Rule Over Oppressed People."
/home/rob/Reference/Crawls/www.snopes.com/business/alliance/procter.asp	False	The president of Procter & Gamble announced on a popular talk show that he donates a portion of the company's profits to the Church of Satan.
/home/rob/Reference/Crawls/www.snopes.com/business/alliance/snapple.asp	False	Snapple is affiliated with the Ku Klux Klan (or donates money to the anti-abortion group Operation Rescue).
/home/rob/Reference/Crawls/www.snopes.com/business/alliance/sanders.asp	False	Colonel Sanders left instructions requiring KFC to donate money to the Ku Klux Klan or feed the homeless for free.
/home/rob/Reference/Crawls/www.snopes.com/business/alliance/dolltalk.asp	False	A Fisher-Price talking doll utters the phrases "Islam is the light" and "Satan is king." 
/home/rob/Reference/Crawls/www.snopes.com/business/alliance/crown.asp	False	The company that makes air fresheners shaped like crowns is owned by the Ku Klux Klan (or the presence of one of these auto accessories signifies the car's owner is a gang member).
/home/rob/Reference/Crawls/www.snopes.com/business/alliance/timberland.asp	False	Timberland is owned by the Ku Klux Klan, a situation lamented in a poem by Maya Angelou.
/home/rob/Reference/Crawls/www.snopes.com/business/alliance/barcode.asp	False	The infamous number '666' appears in all product barcodes.
/home/rob/Reference/Crawls/www.snopes.com/business/alliance/costco.asp	False	Costco warehouse club stores are owned by China.
/home/rob/Reference/Crawls/www.snopes.com/business/alliance/caribou.asp	True	An Islamic bank is the majority owner of the Caribou Coffee chain.
/home/rob/Reference/Crawls/www.snopes.com/business/alliance/curves.asp	True	Gary Heavin, founder and CEO of the fitness chain Curves, supports 
/home/rob/Reference/Crawls/www.snopes.com/business/alliance/menthol.asp	False	Kool menthol cigarettes are owned by the KKK. Or menthols are part of an insidious plot to do away with African-Americans. Or they contain fiberglass. Or they'll render a man's winky inoperable.
/home/rob/Reference/Crawls/www.snopes.com/business/alliance/swastika.asp	False	Heinz marketed swastika-shaped pasta in Germany before and during 
/home/rob/Reference/Crawls/www.snopes.com/business/alliance/marlboro.asp	False	Marlboro is owned by the KKK.
/home/rob/Reference/Crawls/www.snopes.com/business/alliance/hudson.asp	False	In accordance with a requirement of their original Royal Charter, the Hudson's Bay Company of Canada makes annual payments of elk and beaver pelts to the Queen of England. 
/home/rob/Reference/Crawls/www.snopes.com/business/alliance/coors.asp	False	Coors financially supports Nazi groups.
/home/rob/Reference/Crawls/www.snopes.com/business/alliance/domino.asp	False	Domino's Pizza financially supports Operation Rescue, an anti-abortion group.
/home/rob/Reference/Crawls/www.snopes.com/business/origins/ivory.asp	False	Ivory Soap's unique floatability came about as the result of a manufacturing error.
/home/rob/Reference/Crawls/www.snopes.com/business/origins/bottsdots.asp	True	The rounded raised lane markers installed on California roads, Botts' Dots, were named for their inventor.
/home/rob/Reference/Crawls/www.snopes.com/business/origins/champagne.asp	False	Champagne glasses were modeled on Marie Antoinette's breasts.
