/home/rob/Reference/Crawls/www.snopes.com/critters/edibles/dogsoup.asp	False	A Korean company solicited American dog shelters for excess dogs to turn into soup.
/home/rob/Reference/Crawls/www.snopes.com/critters/malice/shark.asp	False	The media is aware that the bull shark that mauled 8-year-old Jessie Arbogast was one his uncle had been fishing for and fighting on a line for two hours, but they are suppressing that information.
/home/rob/Reference/Crawls/www.snopes.com/critters/malice/lucky.asp	False	A seeing eye dog named Lucky caused the deaths of four of his owners.
/home/rob/Reference/Crawls/www.snopes.com/critters/malice/elephant.asp	False	Man is killed by an elephant he mistakes for one he aided years earlier.
/home/rob/Reference/Crawls/www.snopes.com/critters/malice/feces.asp	False	A zookeeper in Paderborn, Germany, was killed when an elephant defecated on him.
/home/rob/Reference/Crawls/www.snopes.com/critters/defender/elephant.asp	False	During the December 2004 tsunami, elephants in Phuket, Thailand, who had broken free from their handlers returned to the beach as soon as the waves had subsided to rescue 
/home/rob/Reference/Crawls/www.snopes.com/critters/snakes/wedding.asp	False	A bride was fatally bitten by a marauding snake while posing for photos in a popular Canadian garden spot.
/home/rob/Reference/Crawls/www.snopes.com/critters/snakes/measured.asp	False	"Affectionate" python is really just measuring its intended victim.
/home/rob/Reference/Crawls/www.snopes.com/critters/snakes/ballpit.asp	False	Venomous snakes lurk in the ball pits of fast food restaurants.
/home/rob/Reference/Crawls/www.snopes.com/critters/gnus/gator.asp	True	Alligators given as gifts escape.
/home/rob/Reference/Crawls/www.snopes.com/critters/gnus/calico.asp	False	Attorney General John Ashcroft believes calico cats are a sign of the devil.
/home/rob/Reference/Crawls/www.snopes.com/critters/gnus/snakebra.asp	True	A sweaterful of snakes was smuggled into Sweden. 
/home/rob/Reference/Crawls/www.snopes.com/critters/gnus/litter.asp	False	Pet owners face yet another hazard: radioactive kitty litter.
/home/rob/Reference/Crawls/www.snopes.com/critters/gnus/chicken.asp	True	The Hollywood Freeway in Los Angeles, California, is the permanent home to a brood of chickens.
/home/rob/Reference/Crawls/www.snopes.com/critters/gnus/slink.asp	True	The Swedish navy once mistook minks for enemy submarines.
/home/rob/Reference/Crawls/www.snopes.com/critters/gnus/snakerob.asp	True	Snakes have been used as hold-up weapons.
/home/rob/Reference/Crawls/www.snopes.com/critters/gnus/mooseluv.asp	True	An amorous moose once wooed a lawn ornament.
/home/rob/Reference/Crawls/www.snopes.com/critters/gnus/jumboluv.asp	True	A village in India learned the hard way not to interfere with the course of pachyderm True Love.
/home/rob/Reference/Crawls/www.snopes.com/critters/gnus/squirrel.asp	True	Frozen squirrels have been used for criminal purposes.
/home/rob/Reference/Crawls/www.snopes.com/critters/wild/babybird.asp	False	Handling by a human will cause a baby bird to be rejected by its mother.
/home/rob/Reference/Crawls/www.snopes.com/critters/wild/pleasure.asp	True	Bonobos and dolphins are the only animals other than humans who engage in sex for pleasure.
/home/rob/Reference/Crawls/www.snopes.com/critters/wild/dogyears.asp	False	Multiplying your dog's age by seven will produce its equivalent in human years. 
/home/rob/Reference/Crawls/www.snopes.com/critters/wild/porcupine.asp	False	Porcupines can launch their quills at attackers.
/home/rob/Reference/Crawls/www.snopes.com/critters/wild/penguin.asp	False	Penguins fall over onto their backs while trying to observe airplanes flying overhead.
/home/rob/Reference/Crawls/www.snopes.com/critters/wild/turkey.asp	False	Domesticated turkeys are so lacking in intelligence that they will look up at falling rain until they drown.
/home/rob/Reference/Crawls/www.snopes.com/critters/wild/eaglerebirth.asp	False	Eagles extend their lifespans by removing their beaks, talons, and feathers in order to grow new ones.
/home/rob/Reference/Crawls/www.snopes.com/critters/wild/bigsnake.asp	False	Indonesian villagers captured a 49-foot, 983-pound python.
/home/rob/Reference/Crawls/www.snopes.com/critters/wild/opossum.asp	False	Opossums can hang by their tails.
/home/rob/Reference/Crawls/www.snopes.com/critters/wild/lawn.asp	Undetermined	Jugs of water left on a lawn will prevent dogs from defecating there.
/home/rob/Reference/Crawls/www.snopes.com/critters/wild/frogboil.asp	False	A frog placed in water that is brought to a boil through gradual temperature increase will make no attempt to escape.
/home/rob/Reference/Crawls/www.snopes.com/critters/wild/duckecho.asp	False	A duck's quack doesn't echo, and no one knows why.
/home/rob/Reference/Crawls/www.snopes.com/critters/wild/mantis2.asp	False	Killing praying mantises is illegal in (parts of) the USA.
/home/rob/Reference/Crawls/www.snopes.com/critters/wild/elephant.asp	False	Elephants are afraid of mice.
/home/rob/Reference/Crawls/www.snopes.com/critters/wild/asthma.asp	False	Chihuahuas cure asthma.
/home/rob/Reference/Crawls/www.snopes.com/critters/wild/catsuck.asp	False	Cats suck the breath from babies, sometimes killing them.
/home/rob/Reference/Crawls/www.snopes.com/critters/wild/mantis1.asp	Not quite	Female praying mantises always eat the heads of their mates.
/home/rob/Reference/Crawls/www.snopes.com/critters/wild/reddye.asp	Undetermined	The red dye used in hummingbird nectar is harmful to the birds.
/home/rob/Reference/Crawls/www.snopes.com/critters/wild/longlegs.asp	False	The daddy longlegs is the "world's most poisonous animal."
/home/rob/Reference/Crawls/www.snopes.com/critters/lurkers/lovebugs.asp	False	"Love bugs" are the result of a genetic experiment gone wrong.
/home/rob/Reference/Crawls/www.snopes.com/critters/lurkers/lovebugs.asp?print=y	False	"Love bugs" are the result of a genetic experiment gone wrong.
/home/rob/Reference/Crawls/www.snopes.com/critters/lurkers/poodlesheep.asp	False	Thousands of Japanese pet owners were victimized by swindlers who sold them sheep and told them the animals were poodles. 
/home/rob/Reference/Crawls/www.snopes.com/critters/cruelty/gopher.asp	True	In the process of attempting to get rid of a gopher, a trio of school custodians blew up their shack. Though all three janitors were carried out on stretchers, the gopher returned to the wild unscathed.
/home/rob/Reference/Crawls/www.snopes.com/critters/cruelty/dynamite.asp	False	Two men are still making payments on a Jeep Cherokee they sent to the bottom of a frozen lake during a duck-hunting mishap.
/home/rob/Reference/Crawls/www.snopes.com/critters/farce/cowtao.asp	False	The rescued crew of a Japanese fishing trawler were held in custody when Russian officials refused to believe their claim that their boat was sunk by a falling cow.
/home/rob/Reference/Crawls/www.snopes.com/critters/farce/deaddeer.asp	Undetermined	An intoxicated motorist hits a deer with his car and, assuming the animal is dead, loads it into his back seat. The deer revives and begins kicking and biting, prompting a hilarious 911 call by the dazed and confused driver.
/home/rob/Reference/Crawls/www.snopes.com/critters/farce/ropedeer.asp	Undetermined	Farmer who attempts to rope a deer describes the painful experience.
/home/rob/Reference/Crawls/www.snopes.com/critters/farce/penguins.asp	False	You can buy a penguin on-line from penguinwarehouse.com.
/home/rob/Reference/Crawls/www.snopes.com/critters/disposal/whale.asp	True	In 1970, the Oregon Department of Transportation attempted to dispose of a whale carcass by blowing it up.
/home/rob/Reference/Crawls/www.snopes.com/critters/disposal/catrat.asp	False	A serious prospectus inviting investors to become part of a cat-and-rat farm was once circulated, the basic premise of which involved skinning cats for their fur, feeding the cat carcasses to rats, then feeding the rats to the cats being raised for their fur.
/home/rob/Reference/Crawls/www.snopes.com/critters/disposal/catchday.asp	True	Woman pens hilarious account of family's efforts to rescue trapped cat from garbage disposal.
/home/rob/Reference/Crawls/www.snopes.com/critters/crusader/ochsclosure.asp	False	The Orange County Humane Society animal shelter in Huntington Beach, California, is closing for good on 8 January 2007 and will euthanize all its animals that are not adopted before then.
/home/rob/Reference/Crawls/www.snopes.com/critters/crusader/raisins.asp	True	Raisins and grapes can be harmful to dogs. 
/home/rob/Reference/Crawls/www.snopes.com/critters/crusader/whalethanks.asp	True	Newspaper article describes an ensnared whale who seemingly thanked her rescuers.
/home/rob/Reference/Crawls/www.snopes.com/critters/crusader/febreze.asp?print=y	False	Ordinary use of Febreze brand fabric refresher poses a general danger to household pets.
/home/rob/Reference/Crawls/www.snopes.com/critters/crusader/minks.asp	True	6,500 minks set free by animal rights activists rampaged through the British countryside.
/home/rob/Reference/Crawls/www.snopes.com/critters/crusader/diamond.asp	Was true in 2006, but now outdated	Diamond Pet Brands recall underway because its dog food caused canine deaths.
/home/rob/Reference/Crawls/www.snopes.com/critters/crusader/huntingdon.asp	False	Huntingdon Life Sciences is offering to pay cash for cats and dogs rescued from New Orleans.
/home/rob/Reference/Crawls/www.snopes.com/critters/crusader/clorox.asp	False	Ordinary use of Ultra Clorox bleach poses a general danger to household pets.
/home/rob/Reference/Crawls/www.snopes.com/critters/crusader/beneful.asp	Undetermined	Mold in Beneful brand dog food is harming dogs.
/home/rob/Reference/Crawls/www.snopes.com/critters/crusader/sharkbait.asp	Multiple &mdash; see below	Fisherman on Réunion Island employ live dogs as bait for shark-fishing.
/home/rob/Reference/Crawls/www.snopes.com/critters/crusader/genpets.asp	False	The web site Genpets.com sells mass-produced, bioengineered pets.
/home/rob/Reference/Crawls/www.snopes.com/critters/crusader/dogflu.asp	True	A virus deadly to dogs has been spreading in the canine population of the U.S.
/home/rob/Reference/Crawls/www.snopes.com/critters/crusader/penguins.asp	True	Crafters have been asked to knit sweaters for oil-soaked penguins.
/home/rob/Reference/Crawls/www.snopes.com/critters/crusader/bonsai.asp	False	A web site provides information and equipment for making 'bonsai kittens.'
/home/rob/Reference/Crawls/www.snopes.com/critters/crusader/savetoby.asp	False	Fellow threatens to eat his pet rabbit unless $50,000 is donated through his web site.
/home/rob/Reference/Crawls/www.snopes.com/critters/crusader/shredder.asp	True	Household paper shredders can pose a danger to children and pets.
/home/rob/Reference/Crawls/www.snopes.com/critters/crusader/puppies.asp	Was true, but not any longer	Abandoned puppies shown in an Internet-circulated photo need homes.
/home/rob/Reference/Crawls/www.snopes.com/critters/crusader/birdrice.asp	False	Rice thrown to wish newly-wedded couples well can kill their fine feathered friends.
/home/rob/Reference/Crawls/www.snopes.com/critters/crusader/chimps.asp	False	Signing an 
/home/rob/Reference/Crawls/www.snopes.com/critters/crusader/xylitol.asp	True	Xylitol (a sugar substitute used in sugar-free gum) can be harmful to dogs.
/home/rob/Reference/Crawls/www.snopes.com/critters/crusader/febreze.asp	False	Ordinary use of Febreze brand fabric refresher poses a general danger to household pets.
/home/rob/Reference/Crawls/www.snopes.com/critters/crusader/greenies.asp	Undetermined	Greenies brand dental chews pose a general danger to dogs.
/home/rob/Reference/Crawls/www.snopes.com/critters/crusader/dogtreat.asp	True	The FDA has issued a warning about chicken jerky dog treats.
/home/rob/Reference/Crawls/www.snopes.com/critters/crusader/dogisland.asp	False	A sanctuary for dogs is maintained on a "dog island" off the coast of Florida.
/home/rob/Reference/Crawls/www.snopes.com/critters/crusader/promeris.asp	Undetermined	E-mail warns that ProMeris brand flea and tick protection may cause severe adverse reactions in pets.
/home/rob/Reference/Crawls/www.snopes.com/critters/crusader/vargas.asp	Undetermined	A Costa Rican artist starved a dog to death as part of a gallery exhibit.
/home/rob/Reference/Crawls/www.snopes.com/critters/crusader/golden.asp	False	A litter of Golden Retriever puppies is about to be euthanized unless homes are quickly found for them.
/home/rob/Reference/Crawls/www.snopes.com/critters/crusader/pitbull.asp	False	Pending California legislation mandates the extermination of pit bulls.
/home/rob/Reference/Crawls/www.snopes.com/critters/crusader/menu.asp	True	A number of pet food products have been recalled due to a possible association with kidney failure-related illnesses and deaths of cats and dogs.
/home/rob/Reference/Crawls/www.snopes.com/critters/mishaps/tennisball.asp	True	A dog was killed when it bit into a tennis ball booby-trapped with explosives.
/home/rob/Reference/Crawls/www.snopes.com/quotes/brazil.asp	Undetermined	American president George Bush asked Brazilian president Fernando Cardoso if "Brazil has blacks, too."
/home/rob/Reference/Crawls/www.snopes.com/quotes/london.asp	Multiple &mdash; see below	E-mail lists reactions to the London subway bombings purportedly collected from Londoners. 
/home/rob/Reference/Crawls/www.snopes.com/quotes/onesmall.asp	True	
/home/rob/Reference/Crawls/www.snopes.com/quotes/internet.asp	False	Vice-President Al Gore claimed that he "invented" the Internet.
/home/rob/Reference/Crawls/www.snopes.com/quotes/mrgorsky.asp	False	Immediately after Neil Armstrong uttered his famous "That's one small step for 
/home/rob/Reference/Crawls/www.snopes.com/quotes/chrisrock.asp	Multiple:	Comedian Chris Rock originated a quip about the best golfer in the world being black and the best rapper being white.
/home/rob/Reference/Crawls/www.snopes.com/quotes/babbin.asp?print=y	True	Jed Babbin said that "going to war without France is like going deer hunting without an accordion."
/home/rob/Reference/Crawls/www.snopes.com/quotes/faraday.asp?print=y	False	When the English prime minister asked scientist Michael Faraday what the usefulness of his electromagnetic device was, Faraday replied, "Someday you can tax it."
/home/rob/Reference/Crawls/www.snopes.com/quotes/signature/elementary.asp	False	Sherlock Holmes said, "Elementary, my dear Watson."
/home/rob/Reference/Crawls/www.snopes.com/quotes/signature/elementary.asp?print=y	False	Sherlock Holmes said, "Elementary, my dear Watson."
/home/rob/Reference/Crawls/www.snopes.com/quotes/nelson.asp	False	Singer Willie Nelson said of his September 2006 drug offense, "It's a good thing I had a bag of marijuana instead of a bag of spinach. I'd be dead by now."  
/home/rob/Reference/Crawls/www.snopes.com/quotes/ellison.asp	False	While delivering the commencement speech at Yale University in 2000, Oracle CEO Larry Ellison said:
/home/rob/Reference/Crawls/www.snopes.com/quotes/brazil.asp?print=y	Undetermined	American president George Bush asked Brazilian president Fernando Cardoso if "Brazil has blacks, too."
/home/rob/Reference/Crawls/www.snopes.com/quotes/edison.asp	True	Inventor Thomas Edison said: "The doctor of the future will give no medicine but will interest his patients in the care of the human frame, in diet and in the cause and prevention of disease." 
/home/rob/Reference/Crawls/www.snopes.com/quotes/carey2.asp	False	When singer Mariah Carey's was asked to comment on the passing of King Hussein of Jordan, she confused him with basketball star Michael Jordan.
/home/rob/Reference/Crawls/www.snopes.com/quotes/carey2.asp?print=y	False	When singer Mariah Carey's was asked to comment on the passing of King Hussein of Jordan, she confused him with basketball star Michael Jordan.
/home/rob/Reference/Crawls/www.snopes.com/quotes/bush.asp	False	President George W. Bush proclaimed, "The problem with the French is that they don't have a word for entrepreneur."
/home/rob/Reference/Crawls/www.snopes.com/quotes/caesar.asp?print=y	False	Julius Caesar bade us beware of leaders who bang the drums of war.
/home/rob/Reference/Crawls/www.snopes.com/quotes/nelson.asp?print=y	False	Singer Willie Nelson said of his September 2006 drug offense, "It's a good thing I had a bag of marijuana instead of a bag of spinach. I'd be dead by now."  
/home/rob/Reference/Crawls/www.snopes.com/quotes/candidate.asp	False, with one exception	Collection of memorable misstatements attributed to John Kerry or George W. Bush.
/home/rob/Reference/Crawls/www.snopes.com/quotes/barry.asp	Mostly false	Washington, D.C. mayor Marion Barry said lots of really dumb things.
/home/rob/Reference/Crawls/www.snopes.com/quotes/powell.asp?print=y	False	Colin Powell made a clever quip to an Iraqi reporter about Americans' inability to find Iraq on a map.
/home/rob/Reference/Crawls/www.snopes.com/quotes/babbin.asp	True	Jed Babbin said that "going to war without France is like going deer hunting without an accordion."
/home/rob/Reference/Crawls/www.snopes.com/quotes/onesmall.asp?print=y	True	
/home/rob/Reference/Crawls/www.snopes.com/quotes/seattle.asp?print=y	False	In 1854 Chief Seattle gave a stirring speech about the sanctity of the land and the need for careful stewardship of it.
/home/rob/Reference/Crawls/www.snopes.com/quotes/vonnegut.asp?print=y	False	In 1997, Kurt Vonnegut gave an unusual commencement address at MIT.
/home/rob/Reference/Crawls/www.snopes.com/quotes/tressel.asp	False	Ohio State football coach Jim Tressel delivered a stirring "Pre-Championship Game Speech" to his players just before the 2003 Fiesta Bowl.
/home/rob/Reference/Crawls/www.snopes.com/quotes/powell.asp	False	Colin Powell made a clever quip to an Iraqi reporter about Americans' inability to find Iraq on a map.
/home/rob/Reference/Crawls/www.snopes.com/quotes/internet.asp?print=y	False	Vice-President Al Gore claimed that he "invented" the Internet.
/home/rob/Reference/Crawls/www.snopes.com/quotes/mrgorsky.asp?print=y	False	Immediately after Neil Armstrong uttered his famous "That's one small step for 
/home/rob/Reference/Crawls/www.snopes.com/quotes/carey.asp?print=y	False	In a 1996 interview, Mariah Carey said the following:
/home/rob/Reference/Crawls/www.snopes.com/quotes/clinton.asp	Not quite	In 1974, Bill Clinton said about President Richard Nixon's involvement in the Watergate scandal: 
/home/rob/Reference/Crawls/www.snopes.com/quotes/oprah.asp?print=y	Undetermined	Oprah Winfrey opines on men.
/home/rob/Reference/Crawls/www.snopes.com/quotes/reno.asp	False	Janet Reno provided her definition of a "cultist" during a 
/home/rob/Reference/Crawls/www.snopes.com/quotes/candidate.asp?print=y	False, with one exception	Collection of memorable misstatements attributed to John Kerry or George W. Bush.
/home/rob/Reference/Crawls/www.snopes.com/quotes/lauryn.asp	False	During an MTV interview singer Lauryn Hill said, "I would rather die than have a white person buy one of my albums."
/home/rob/Reference/Crawls/www.snopes.com/quotes/carey.asp	False	In a 1996 interview, Mariah Carey said the following:
/home/rob/Reference/Crawls/www.snopes.com/quotes/macarthur.asp?print=y	Multiple &mdash; see below	During a 1955 speech at West Point, General Douglas MacArthur told assembled cadets: "The next war will be an interplanetary war. The nations of the earth must someday make a common front against attack by people from other planets."
/home/rob/Reference/Crawls/www.snopes.com/quotes/kenolsen.asp	True	In 1977, Ken Olsen, the founder and CEO of Digital Equipment Corporation, said, "There is no reason for any individual to have a computer in his home." 
/home/rob/Reference/Crawls/www.snopes.com/quotes/seattle.asp	False	In 1854 Chief Seattle gave a stirring speech about the sanctity of the land and the need for careful stewardship of it.
/home/rob/Reference/Crawls/www.snopes.com/quotes/caesar.asp	False	Julius Caesar bade us beware of leaders who bang the drums of war.
/home/rob/Reference/Crawls/www.snopes.com/quotes/lincoln.asp	False	Abraham Lincoln issued a prophetic warning about the tyranny of capitalism.
/home/rob/Reference/Crawls/www.snopes.com/quotes/goering.asp	True	Hermann Goering  proclaimed that although "the people don't want war," they "can always be brought to the bidding of their leaders."
/home/rob/Reference/Crawls/www.snopes.com/quotes/einstein/bees.asp?print=y	Undetermined	Albert Einstein predicted that if something eliminated bees from our planet, mankind would soon perish.
/home/rob/Reference/Crawls/www.snopes.com/quotes/einstein/interest.asp?print=y	Undetermined	Albert Einstein once declared compound interest to be "the most powerful force in the universe." 
/home/rob/Reference/Crawls/www.snopes.com/quotes/einstein/interest.asp	Undetermined	Albert Einstein once declared compound interest to be "the most powerful force in the universe." 
/home/rob/Reference/Crawls/www.snopes.com/quotes/einstein/bees.asp	Undetermined	Albert Einstein predicted that if something eliminated bees from our planet, mankind would soon perish.
/home/rob/Reference/Crawls/www.snopes.com/quotes/armey.asp	True	Rep. Dick Armey offered a humorous quip about President Clinton's troubles during the Monica Lewinsky scandal.
/home/rob/Reference/Crawls/www.snopes.com/quotes/barry.asp?print=y	Mostly false	Washington, D.C. mayor Marion Barry said lots of really dumb things.
/home/rob/Reference/Crawls/www.snopes.com/quotes/twain.asp?print=y	False	Mark Twain once asserted "The coldest winter I ever spent was a summer in San Francisco."
/home/rob/Reference/Crawls/www.snopes.com/quotes/yogiberra.asp	False	Transcript reproduces 2007 commencement address delivered by Yogi Berra at Saint Louis University.
/home/rob/Reference/Crawls/www.snopes.com/quotes/bush.asp?print=y	False	President George W. Bush proclaimed, "The problem with the French is that they don't have a word for entrepreneur."
/home/rob/Reference/Crawls/www.snopes.com/quotes/reno.asp?print=y	False	Janet Reno provided her definition of a "cultist" during a 
/home/rob/Reference/Crawls/www.snopes.com/quotes/ali.asp	Undetermined	Boxer Muhammad Ali's refusal to wear a seat belt on a plane spurred an answering quip from a stewardess.
/home/rob/Reference/Crawls/www.snopes.com/quotes/edison.asp?print=y	True	Inventor Thomas Edison said: "The doctor of the future will give no medicine but will interest his patients in the care of the human frame, in diet and in the cause and prevention of disease." 
/home/rob/Reference/Crawls/www.snopes.com/quotes/oprah.asp	Undetermined	Oprah Winfrey opines on men.
/home/rob/Reference/Crawls/www.snopes.com/quotes/ellison.asp?print=y	False	While delivering the commencement speech at Yale University in 2000, Oracle CEO Larry Ellison said:
/home/rob/Reference/Crawls/www.snopes.com/quotes/kenolsen.asp?print=y	True	In 1977, Ken Olsen, the founder and CEO of Digital Equipment Corporation, said, "There is no reason for any individual to have a computer in his home." 
/home/rob/Reference/Crawls/www.snopes.com/quotes/twain.asp	False	Mark Twain once asserted "The coldest winter I ever spent was a summer in San Francisco."
/home/rob/Reference/Crawls/www.snopes.com/quotes/mackinnon.asp?print=y	False	Feminist Catharine MacKinnon said "All sex is rape." 
/home/rob/Reference/Crawls/www.snopes.com/quotes/giap.asp	False	Vietnamese general Vo Nguyen Giap's memoirs pinned U.S. military failure in Vietnam on American anti-war protesters.
/home/rob/Reference/Crawls/www.snopes.com/quotes/mackinnon.asp	False	Feminist Catharine MacKinnon said "All sex is rape." 
/home/rob/Reference/Crawls/www.snopes.com/quotes/goering.asp?print=y	True	Hermann Goering  proclaimed that although "the people don't want war," they "can always be brought to the bidding of their leaders."
/home/rob/Reference/Crawls/www.snopes.com/quotes/vonnegut.asp	False	In 1997, Kurt Vonnegut gave an unusual commencement address at MIT.
/home/rob/Reference/Crawls/www.snopes.com/quotes/yogiberra.asp?print=y	False	Transcript reproduces 2007 commencement address delivered by Yogi Berra at Saint Louis University.
/home/rob/Reference/Crawls/www.snopes.com/quotes/ali.asp?print=y	Undetermined	Boxer Muhammad Ali's refusal to wear a seat belt on a plane spurred an answering quip from a stewardess.
/home/rob/Reference/Crawls/www.snopes.com/quotes/faraday.asp	False	When the English prime minister asked scientist Michael Faraday what the usefulness of his electromagnetic device was, Faraday replied, "Someday you can tax it."
/home/rob/Reference/Crawls/www.snopes.com/quotes/lauryn.asp?print=y	False	During an MTV interview singer Lauryn Hill said, "I would rather die than have a white person buy one of my albums."
/home/rob/Reference/Crawls/www.snopes.com/quotes/clinton.asp?print=y	Not quite	In 1974, Bill Clinton said about President Richard Nixon's involvement in the Watergate scandal: 
/home/rob/Reference/Crawls/www.snopes.com/quotes/chrisrock.asp?print=y	Multiple:	Comedian Chris Rock originated a quip about the best golfer in the world being black and the best rapper being white.
/home/rob/Reference/Crawls/www.snopes.com/quotes/macarthur.asp	Multiple &mdash; see below	During a 1955 speech at West Point, General Douglas MacArthur told assembled cadets: "The next war will be an interplanetary war. The nations of the earth must someday make a common front against attack by people from other planets."
/home/rob/Reference/Crawls/www.snopes.com/quotes/giap.asp?print=y	False	Vietnamese general Vo Nguyen Giap's memoirs pinned U.S. military failure in Vietnam on American anti-war protesters.
/home/rob/Reference/Crawls/www.snopes.com/quotes/reagan/redwoods.asp?print=y	Paraphrase	Ronald Reagan once said (in reference to forest conservation efforts), "If you've seen one redwood, you've seen them all."
